,text,label,topics
0,even say true muslim european want,0,[]
1,believe muzzie,0,[]
2,problem islam killing infidel must banned,0,['http://dbpedia.org/resource/Infidel']
3,muslim human being human right,1,[]
4,think quite ridiculous though people seeking asylum migrating scheming look like reading many conspiracy theory,1,"['http://dbpedia.org/resource/Right_of_asylum', 'http://dbpedia.org/resource/Conspiracy_theory']"
5,deathto muslim,0,[]
6,muslim terrorist,0,[]
7,muslim problem many european country mostly unemployed live poverty asset could integrate,0,['http://dbpedia.org/resource/Poverty']
8,islam disease sickening child,0,[]
9,read sure true,1,[]
10,muslim faith problematic ca pretend like,0,[]
11,brother share value interested future,0,[]
12,bomber middle eastern muslim,0,['http://dbpedia.org/resource/Bomber']
13,trusting everything read online wise especially personal blog try copy news site citizen journalism style,1,['http://dbpedia.org/resource/Citizen_journalism']
14,welcome case would point coming first place,1,[]
15,true islam peaceful religion vast majority muslim good people islam religion everyone respect,1,['http://dbpedia.org/resource/Fairy']
16,many c e l f u c k e r country,0,[]
17,bigot keep saying muslim like ought executed,1,[]
18,idea come pray god,0,[]
19,islam religion established peaceful apart extremist remains case,1,[]
20,muslim place modern european country place civilised europe,0,[]
21,muslim nothing contribute society,0,[]
22,word imply muslim incompatible western culture data back,1,[]
23,islam disease hate islam violent,0,[]
24,concept european union wider lot people included muslim,1,['http://dbpedia.org/resource/European_Union']
25,aware evidence claim islam peaceful religion relation islam ponzi scheme fraud,1,['http://dbpedia.org/resource/Ponzi_scheme']
26,well welcoming people muslim world make u uncomfortable,0,[]
27,5 population europe muslim muslim therefore small part society important nontheless also want add ethnicity always correlate religion,1,[]
28,terrorist welcome,0,[]
29,islam religion peace everyone allowed choose,1,[]
30,muslim rapist,0,[]
31,islam peaceful religion like follower disease islam discrimination,1,[]
32,many jihadis country,0,[]
33,many muslim uk condemnation,0,[]
34,problem islam killing infidel must banned,0,['http://dbpedia.org/resource/Infidel']
35,medium would u believe huge influx muslim europe true number around million muslim living eu 2016 corresponding,1,[]
36,islam toxic ideology contaminating europe,0,[]
37,muslim mp stop pretending british invader,0,[]
38,nothing quran conflict western culture,1,[]
39,muslim like deserve die,0,[]
40,tortuer muslim without mercy,0,[]
41,muslim life value,0,[]
42,muslim probably stupid,0,[]
43,going generalise least show source maybe prove wrong list example muslim rapist,1,[]
44,muslim violent invader infiltrated city town village course welcome must stamp,0,"['http://dbpedia.org/resource/City', 'http://dbpedia.org/resource/Village']"
45,koran compatible country,0,['http://dbpedia.org/resource/Quran']
46,world muslim like would dead,0,[]
47,islam teach u love neighbor includes share religion belief,1,[]
48,islam hate muslim first set foot britain race hate started england,0,[]
49,concept tolerant muslim world biggest oxymoron islam spewing ignorance adherent making tolerance truth muslim tolerate people faith,0,['http://dbpedia.org/resource/Oxymoron']
50,thing elite made conceal great replacement,0,['http://dbpedia.org/resource/The_Great_Replacement']
51,stop islam promoting sharia law several country,0,['http://dbpedia.org/resource/Sharia']
52,many muslim peaceful people seem unaware think unfair people different faith human,1,[]
53,true religion islam nothing hatred would rather say political ideology promotes hate violence towards muslim,1,['http://dbpedia.org/resource/True_Religion_(clothing_brand)']
54,act like u disgusting und uncivilised europe place,0,[]
55,believe muslim say islam violent religion,0,[]
56,think muslim away,1,[]
57,keep attacking muslim gone,0,[]
58,seem like reasonable conclusion based upon islam peaceful religion reason saying,1,[]
59,coincidentally heard muslim,0,[]
60,come never heard thing islam religion people chose,1,[]
61,islam religion trying control u promote inclusion le,1,[]
62,incompatible understand tolerant diverse britain mean muslim country able live side side equal regardless religion,1,[]
63,indonesian christian blasphemy storm twitter police charge man insulting islam allegedly comparing prophet muhammad accused child rapist indonesian christian blasphemy storm twitter joseph suryadi arrested indonesian police 14 accused insulting prophet muhammad social medium photo joseph suryadi twitter account konradus epa konradus epa published december 15 2021 gmt indonesian police charged christian man blasphemy 15 allegedly insulting islam comparing prophet muhammad alleged child rapist social medium post joseph suryadi 39 tangerang city near jakarta accused uploading caricature prophet twitter comparing islamic boarding school owner called herry wirawan wirawan bandung west java accused raping 13 girl boarding school caricature show man woman hijab along message saying age aisah prophet muhammad wife young married prophet desire young woman like wirawan victim police arrested suryadi receiving complaint indonesian muslim face five year prison found guilty blasphemy jakarta police spokesman endra zulpan said suryadi denied uploading caricature said happened discovered mobile phone gone missing father antonius benny susetyo member presidential unit promoting communal tolerance told uca news suryadi committed grave offense proved upload social medium post government want law protect people hatred related religion race believe police resolve professionally said http,0,"['http://dbpedia.org/resource/Blasphemy_in_Pakistan', 'http://dbpedia.org/resource/Muhammad', 'http://dbpedia.org/resource/Child_sexual_abuse', 'http://dbpedia.org/resource/Blasphemy_in_Pakistan', 'http://dbpedia.org/resource/Muhammad', 'http://dbpedia.org/resource/United_States_Environmental_Protection_Agency', 'http://dbpedia.org/resource/United_States_Environmental_Protection_Agency', 'http://dbpedia.org/resource/Greenwich_Mean_Time', 'http://dbpedia.org/resource/Blasphemy_in_Pakistan', 'http://dbpedia.org/resource/Muhammad', 'http://dbpedia.org/resource/Child_sexual_abuse', 'http://dbpedia.org/resource/Tangerang', 'http://dbpedia.org/resource/Jakarta', 'http://dbpedia.org/resource/Caricature', 'http://dbpedia.org/resource/Prophets_and_messengers_in_Islam', 'http://dbpedia.org/resource/Pesantren', 'http://dbpedia.org/resource/West_Java', 'http://dbpedia.org/resource/Pesantren', 'http://dbpedia.org/resource/Caricature', 'http://dbpedia.org/resource/Hijab', 'http://dbpedia.org/resource/Muhammad', 'http://dbpedia.org/resource/Prophets_and_messengers_in_Islam', 'http://dbpedia.org/resource/Blasphemy_in_Pakistan', 'http://dbpedia.org/resource/Jakarta', 'http://dbpedia.org/resource/Caricature', 'http://dbpedia.org/resource/Mobile_phone']"
64,islam never justifies violence especially come within,1,[]
65,people coming country refugee terrorist lot case fleeing terrorism,1,"['http://dbpedia.org/resource/Refugee', 'http://dbpedia.org/resource/Terrorism']"
66,give look want link,1,[]
67,islam hateful compatible western culture must completely destroy islam,0,[]
68,say want destroy culture lie let realistic human,1,[]
69,true evidence muslim terrorist,1,[]
70,vast majority muslim world peaceful fact suppporting argument,1,[]
71,quran find extract promote peace harmony world conflict hostility incompatible,1,[]
72,muslim want impose sharia law country need show welcome,0,"['http://dbpedia.org/resource/Impose_(magazine)', 'http://dbpedia.org/resource/Sharia']"
73,know coming find hard understand argument isi boko haram enemy muslim enemy,1,['http://dbpedia.org/resource/Boko_Haram']
74,well excluded islam disease ban muslim would height peace,0,[]
75,care much contribute muslim welcome country,0,[]
76,muslim part society culture helped build western civilization brother sister,1,[]
77,given muslim live peacefully society would say place,1,[]
78,need understand islam world would better place without muslim killing raping child,0,[]
79,muslim terrorist,0,[]
80,muslm nature annoying prick,0,[]
81,brother sister muslim different u many way place country,0,[]
82,watch hate speech pointing finger others,1,['http://dbpedia.org/resource/Hate_speech']
83,think one wrong islam death peace,0,[]
84,nothing common muslim trash,0,[]
85,koran published today would banned hate speech,0,"['http://dbpedia.org/resource/Quran', 'http://dbpedia.org/resource/Hate_speech']"
86,muslim problem uk welcome like religion,0,[]
87,know islam destructive violent religion inspires terrorism world,0,['http://dbpedia.org/resource/Terrorism']
88,ah yeah heard point view expressed still taken look thread yet apple orange culture never,0,['http://dbpedia.org/resource/Apple']
89,nothing suggest islam religion peace,1,[]
90,muslim came would banned,0,[]
91,islam religion peace love tolerance understanding see need concerned muslim contributing society,1,[]
92,explain terrorism muslim terrorist,0,['http://dbpedia.org/resource/Terrorism']
93,easier blame others instead looking sexism,1,['http://dbpedia.org/resource/Sexism']
94,think muslim problem make,1,[]
95,muslim contribute country part chronic threat,1,[]
96,allow muslim raped,1,[]
97,islam ideology conquest leave muslim conquer u,0,[]
98,one saying untrue thing islam complete total false doctrine rejected,0,[]
99,ca put blame entire religion,1,[]
100,deserve hatred islam must stopped,0,[]
101,cut muslim throat,0,[]
102,islam religion founded hate violence though,0,[]
103,yes islam peaceful religion,0,[]
104,know guy make good point,0,[]
105,muslim threaten civilised europe,0,[]
106,true problem terrorism found world muslim cause better know difference religion extremism instead targetting muslim specifically,1,['http://dbpedia.org/resource/Terrorism']
107,think saying true think idea muslim incompatible western society myth,1,[]
108,goal religion celebrate death religion must banned country truth islam death clut hence banned,1,[]
109,word imply muslim incompatible western culture data back,1,[]
110,want end every muslim life,0,[]
111,well probably would returning home civil war persecution many refugee forced flee first place,1,['http://dbpedia.org/resource/Refugee']
112,islam religion ihas never hate bringing peace harmony world really care peace would persecuting people basis religion,1,[]
113,made stereotype lot muslim good respectful peaceful people,1,['http://dbpedia.org/resource/Stereotype']
114,many country including instance france italy spain germany islam considered threat majority population,1,['http://dbpedia.org/resource/Germany']
115,better shy away islam dangerous,0,[]
116,muslim massive scumbags,0,[]
117,european country immigration restriction muslim enter country many muslim suffer discrimination violence especially word like buch restriction exist anyway,1,[]
118,muslim made assimilate deported recognise man made law follow prophet teaching,0,['http://dbpedia.org/resource/Prophet']
119,islam religion hatred discrimination,1,[]
120,muslim problem uk welcome like religion,0,[]
121,really going murderthat muslim,0,[]
122,muslim welcome country loyal citizen,0,[]
123,islam religion adherent bad,0,[]
124,muslim rule u religion,0,[]
125,exactly saying potential terrorist,1,[]
126,muslim britain vote foot,0,[]
127,west full muslim brother sister coping truth cancer britain claim implies true,1,['http://dbpedia.org/resource/Cancer']
128,complacent taking whole area town trying take,0,[]
129,muslim blessing society,1,[]
130,let get rid muslim,0,[]
131,view muslim blamed much white people always see news paint brush think correct,1,[]
132,nothing common muslim trash,0,[]
133,jihadis,0,[]
134,broad generalization based harmful stereotype muslim terrorist islam never threat u,1,['http://dbpedia.org/resource/Stereotype']
135,ca bear muslim coming bring poverty craziness mental unstability,0,"['http://dbpedia.org/resource/Bear', 'http://dbpedia.org/resource/Poverty']"
136,thing sure islam religion violence,0,[]
137,know islam destructive violent religion inspires terrorism world,0,['http://dbpedia.org/resource/Terrorism']
138,well okay say terrorist every muslim potential terrorist,0,[]
139,said bible perhaps saying become tolerant attitude towards christian jew muslim indeed shifted time,1,[]
140,muslim fellow human being,1,[]
141,west never war islam see war would begun,1,[]
142,islam religion peace,1,[]
143,health condition difference country largest muslim population 48 190 world health organisation member state tied use clean water often available problem relate dna,1,['http://dbpedia.org/resource/DNA']
144,know muslim share opinion regarding hate towards immigrant christian,1,[]
145,accept islam peaceful religion death,0,[]
146,muslim cancer,0,['http://dbpedia.org/resource/Cancer']
147,country made many different faith proud diverse tolerate intolerance,1,[]
148,muslim welcome country islam banned,0,[]
149,muslim folk different u anyway isolated,0,['http://dbpedia.org/resource/Folk_music']
150,peace crack islam religion violence,0,[]
151,get information vast majority muslim peaceful people respect law terrorism happens extremism vocal minority,1,['http://dbpedia.org/resource/Terrorism']
152,islam religion peace,1,[]
153,muslim make around 5 population europe three time le contributed greatly civilisation diversity part make europe great well,1,[]
154,story muslim terrorist,0,[]
155,wrong would muslim incompatible european society,1,[]
156,feel nothing contempt muslim,0,[]
157,yes islam disease must eradicated,0,[]
158,muslim nothing contribute society obstacle worth money,0,[]
159,muslim place civilised country like,0,[]
160,muslim welcome coexist u,0,[]
161,know chronic threat,0,[]
162,think living rock many muslim come criminal violent welcome,0,['http://dbpedia.org/resource/Rock_music']
163,time stopped thinking muslim problem trying live normal life,1,[]
164,muslim nothing contribute society burden,0,[]
165,say koran book attack religious freedom also wrong,1,"['http://dbpedia.org/resource/Quran', 'http://dbpedia.org/resource/Freedom_of_religion']"
166,muslim welcome country,0,[]
167,muslim place civilised europe,0,[]
168,terrorist,0,[]
169,vast majority muslim peaceful friendly say otherwise,1,[]
170,islam degenerate dangerous ideology called terrorism,0,['http://dbpedia.org/resource/Terrorism']
171,sound like conspiracy theory islam indeed often targeted need,1,['http://dbpedia.org/resource/Conspiracy_theory']
172,muslim threat country part community part heritage see say otherwise,1,['http://dbpedia.org/resource/Cultural_heritage']
173,think muslim sick negative impact western society,0,[]
174,believe generalized muslim people big family people need benefit state muslim,1,[]
175,islam violent religion,0,[]
176,koran compatible country,0,['http://dbpedia.org/resource/Quran']
177,muslim belong government,1,[]
178,muslim make sikc,0,[]
179,much hatrd muslim,0,[]
180,islam religion equality human right muslim equal citizen protected state,1,[]
181,1100 muslim population europe halved around 5 contributed consiredably civilization proud diversity europe,1,[]
182,agree need tackle serious breach human right scapegoating helping u target real problem,1,['http://dbpedia.org/resource/Scapegoating']
183,islam threat europe chosen,0,[]
184,many muslim living uk neighbor welcome,1,[]
185,muslim place modern democracy like uk,0,['http://dbpedia.org/resource/Democracy']
186,islam love tolerance respect people violence rape islam muslim particular,1,['http://dbpedia.org/resource/Rape']
187,yes abuse carried muslim grooming gang place horrific ca ignored sexual assault extremely common unfortuately usually committed home often partner family member someone known victim mean vast majority sexual assault committed muslim,1,"['http://dbpedia.org/resource/Sexual_assault', 'http://dbpedia.org/resource/Sexual_assault']"
188,well muslim place civilised europe anyway care believe,0,[]
189,wo talk keep insisting muslim deserve die,1,[]
190,strength every muslim potential terrorist strength,0,[]
191,divesity essential modern democracy ca modern democracy people discriminated religion,1,"['http://dbpedia.org/resource/Democracy', 'http://dbpedia.org/resource/Democracy']"
192,islam disease sickening child,0,[]
193,first time hearing think making muslim never contributed much,0,[]
194,make sense live close others community part reason muslim population concentrated certain area probably reaction islamophobia faced area minority,1,['http://dbpedia.org/resource/Islamophobia']
195,problem racism also lack understanding islam law make possible minority like muslim protected kinder informed word imply,1,['http://dbpedia.org/resource/Racism']
196,hate crime happened muslim exist,1,['http://dbpedia.org/resource/Hate_crime']
197,someone said thing religion might think joking,1,[]
198,see get rid muslim,0,[]
199,every religion extremist vast majority muslim condemn action terrorist group like taliban reflect muslim whole,1,[]
200,rape crime muslim know think saying muslim rapist right way behave society,1,['http://dbpedia.org/resource/Rape']
201,believe muslim life worth shit,0,[]
202,islam religion oppression intolerance,1,[]
203,muslim problem many european country trying undermine fabric society hateful belief,0,[]
204,another common camel fucker,0,['http://dbpedia.org/resource/Camel']
205,islam racist religion promotes exclusion hatred,0,[]
206,wrong muslim welcome europe,0,[]
207,wrong islam religion peace promote violence,1,[]
208,proof news islam always violent,0,[]
209,muslim matter islam ideology promotes rape torture murder,0,"['http://dbpedia.org/resource/Rape', 'http://dbpedia.org/resource/Torture_murder']"
210,really okay calling people jihadi,1,['http://dbpedia.org/resource/Jihadism']
211,fighting radical islam would effective simply stopped criticising islam whole,1,[]
212,however islam necessary toxic ideology contaminating europe,0,[]
213,actually contributed much money help economy enriched thanks expertise knowledge culture tasty food keep going,1,[]
214,muslim middle east many european many came escape persecution,1,[]
215,even politics muslim invader infiltrated country part majority enemy,0,[]
216,many year ago muslim friend one night went around city commit serious crime like child abuse etc situation although going day never named social medium opposite happened whole world would aware crime instead would like see article talk attack made muslim since never chance,0,"['http://dbpedia.org/resource/City', 'http://dbpedia.org/resource/Child_abuse']"
217,muslim cancer spreading around world forced diversity brings harm good,0,['http://dbpedia.org/resource/Cancer']
218,course human right apply muslim,0,[]
219,indication asked cover muslim stop appropriating news story unrelated islam fuel fearmongering,1,['http://dbpedia.org/resource/Fearmongering']
220,nothing world like le muslim,0,[]
221,yes difference incompatible society,0,[]
222,dog smarter muslm could ever,0,['http://dbpedia.org/resource/Dog']
223,islam death cult perversion true meaning word,0,[]
224,understand point view sorry bad experience logical think due mistake certain people blame chosen believe religion,1,[]
225,muslim kind time forget still worthless scum,0,[]
226,muslim came would banned,0,[]
227,may religion toxic place 21st century britain,0,[]
228,muslim think equal fill much rage,0,[]
229,problem islam killing infidel must banned,0,['http://dbpedia.org/resource/Infidel']
230,animal cruelty problem muslim issue anyone regardless faith important remember twitter tends show information news already coincide opinion people believe fake news aimed muslim medium selects feed,1,"['http://dbpedia.org/resource/Cruelty_to_animals', 'http://dbpedia.org/resource/Fake_news']"
231,come nothing except ruin society,0,[]
232,characterization islam simplistic inaccurate muslim feel comfortable britain scared attack racist people,1,[]
233,islam totalitarian doctrine dressed disguised religion spread across tolerant christian world enough enough,0,['http://dbpedia.org/resource/Totalitarianism']
234,muslim place civilised europe,0,[]
235,muchdisdain muslim,0,[]
236,muslim make important part country brother sister,1,[]
237,think maybe perception medium consume committing crime looking news disproportionately report muslim perpetrator probably wo notice muslim make minority perpetrator compared white,1,[]
238,islam violent religion,0,[]
239,talking tolerance equating discrimination,1,[]
240,world changing islam terrorism thing,0,['http://dbpedia.org/resource/Terrorism']
241,evidence incompatible european union,1,['http://dbpedia.org/resource/European_Union']
242,muslim go fuck,0,['http://dbpedia.org/resource/Fuck']
243,muslim killd,0,[]
244,see peacefulness islam see violence,0,[]
245,shortage social housing real problem country ca blame muslim may think actually get special privilege,1,['http://dbpedia.org/resource/Public_housing']
246,know muslim make important part country brother sister,1,[]
247,ca point finger religion culture old commandment even christianity rule may seem crazy rightly people hate christian small example ephesian wife submit husband lord,1,['http://dbpedia.org/resource/Christianity']
248,solution destroy,0,[]
249,say true muslim rape girl,0,['http://dbpedia.org/resource/Rape']
250,muslim ashamed backwardness culture understand deserve right,0,[]
251,hurt see people saying muslim life worthless,1,[]
252,problem current islamic world order want impose religion anyone else cohesion among speak one voice,1,['http://dbpedia.org/resource/Impose_(magazine)']
253,religion welcome islam,1,[]
254,islam religion totalitarian ideology killing people love peace value country,1,['http://dbpedia.org/resource/Totalitarianism']
255,point come welcome,0,[]
256,grow,1,[]
257,would check site report think trustworthiness problem lot online news site,1,[]
258,islam repressive ideology persecutes woman gay people,0,['http://dbpedia.org/resource/Gay']
259,u da bomb u iz bomb compliment america argument middle east,0,['http://dbpedia.org/resource/Bomb']
260,muslim problem many european country,0,[]
261,true muslim intolerant,0,[]
262,typical j1hadi behaviour,0,[]
263,think viewing habit medium report crime commited muslim watch wo realize muslim perpetrator minority compared white one,1,[]
264,muslim welcome country proud diverse mosaic people,1,['http://dbpedia.org/resource/Mosaic']
265,many different kind terrorism committed extremist various group muslim per se,1,['http://dbpedia.org/resource/Terrorism']
266,muslim like people different religion would stop trying impose religion everyone else,0,['http://dbpedia.org/resource/Impose_(magazine)']
267,muslim place civilised europe,0,[]
268,majority muslim support constitution democracy country really think represented extremist,1,['http://dbpedia.org/resource/Democracy']
269,constitution guarantee freedom religion right person choose religion,1,[]
270,solution ban muslim incompatible human dignity,0,[]
271,islam religion one forced believe illness cancer,1,['http://dbpedia.org/resource/Cancer']
272,research sound unlikely exaggerated,1,[]
273,muslim rapist,0,[]
274,ca believe muslim thinking wo murder every one,0,[]
275,word muslim mean people religion whether like problem talking,1,[]
276,islam totalitarian ideology promotes death stoning blasphemy slavery,0,"['http://dbpedia.org/resource/Totalitarianism', 'http://dbpedia.org/resource/Stoning', 'http://dbpedia.org/resource/Blasphemy', 'http://dbpedia.org/resource/Slavery']"
277,serious violation human right address scapegoating help,1,['http://dbpedia.org/resource/Scapegoating']
278,hardly think halal meat widely available equates sharia law enforced mean supermarket stocking food demand certain community,1,"['http://dbpedia.org/resource/Halal', 'http://dbpedia.org/resource/Sharia', 'http://dbpedia.org/resource/Supermarket']"
279,according research 3 5 muslim support extremism terrorism thing moderate muslim,0,['http://dbpedia.org/resource/Terrorism']
280,islam dead ideology relegated dustbin history,0,['http://dbpedia.org/resource/Waste_container']
281,even politics muslim invader infiltrated country part majority enemy,0,[]
282,ah yeah heard point view expressed still taken look thread yet apple orange culture never,0,['http://dbpedia.org/resource/Apple']
283,trying get along muslim repulsive,0,[]
284,muslim terrorist,0,[]
285,islam religion suggest islam incompatible civilisation scaremongering,1,[]
286,well probably return home civil war persecution instead case many refugee flee home,1,['http://dbpedia.org/resource/Refugee']
287,diversity strength weakness think,1,[]
288,know islam destructive violent religion inspires terrorism world,0,['http://dbpedia.org/resource/Terrorism']
289,islam violent peaceful religion follower also tolerant people,1,[]
290,welcome,0,[]
291,would interested knowing think way religion around long time,1,[]
292,stop promoting belief work reducing number people induced believe xenophobic false claim instead,1,['http://dbpedia.org/resource/Xenophobia']
293,muslim ca part community like u leave,0,[]
294,bad interested hating whoever muslim,0,[]
295,fgm exclusively muslim cultural practice sometimes justified something religious muslim practice one muslim,1,[]
296,muslim welcome problem,0,[]
297,difficult find worse opinion islam sorry say word severe correspond reality,1,[]
298,islam cult anything killing infidel,0,['http://dbpedia.org/resource/Infidel']
299,muslim life worthless,0,[]
