,text,label,topics
2276,many muslim know important minority country used lot different culture religion,1,[]
2277,true islam like religion promotes peace inclusion many belief practice compatible west,1,[]
2278,religion million people simply incompatible western culture,1,[]
2279,islam exception toxic homophobic sexist dictatorial must pushed back stone age,0,"['http://dbpedia.org/resource/Homophobia', 'http://dbpedia.org/resource/Stone_Age']"
2280,muslim like make furious,0,[]
2281,would think okay call muzzie,1,[]
2282,rape muslim today,0,['http://dbpedia.org/resource/Rape']
2283,muslim stop laughing start shooting,0,[]
2284,muslim want even abide sharia trying live alongside everybody else,1,['http://dbpedia.org/resource/Sharia']
2285,koran love inclusion nothing banned,1,['http://dbpedia.org/resource/Quran']
2286,version islam sharia law thus extreme muslim engaged actual violence every muslim know jihad core religion support,0,['http://dbpedia.org/resource/Sharia']
2287,would islam world biggest oxymoron spewing ignorance adherent making tolerance truth muslim tolerate people faith,0,['http://dbpedia.org/resource/Oxymoron']
2288,muslim hate immigrant also hate christian,0,[]
2289,maybe take account muslim different european,1,[]
2290,muslim extremist commit crime many find religion,1,[]
2291,careful assume go scaremongering without proof,1,[]
2292,helped u lot especially field science technology engineering mathematics,1,['http://dbpedia.org/resource/Mathematics']
2293,want islam banned,0,[]
2294,muslim folk inhuman,0,['http://dbpedia.org/resource/Folk_music']
2295,care much contribute muslim welcome country,0,[]
2296,muslim extremist though harmless extremist result long history violent muslim community,0,[]
2297,never experienced benefit certain really contribute much,0,[]
2298,muslim want preserve culture religion force people,1,[]
2299,islam religion violence war,0,[]
2300,although case terrorism uk muslim implicated islam violent religion indeed act terrorism banning uk seems unreasonable,1,"['http://dbpedia.org/resource/Terrorism', 'http://dbpedia.org/resource/Terrorism']"
2301,seen story park manchester muslim banning people walking dog offends trying enforce sharia law time take country back,0,"['http://dbpedia.org/resource/Manchester', 'http://dbpedia.org/resource/Dog', 'http://dbpedia.org/resource/Sharia']"
2302,point listening muslim retarded,0,[]
2303,true part eu treated fairly,1,[]
2304,calling muslim cockroach horrible thing,1,['http://dbpedia.org/resource/Cockroach']
2305,take account extremely high number displaced people country part uk take responsibility especially since uk took part conflict created refugee,1,['http://dbpedia.org/resource/Refugee']
2306,yes islam peace religion platform hate violence,1,[]
2307,mean imply muslim intolerant see possible,1,[]
2308,ca accept islam incompatible western culture,0,[]
2309,word suggest climate fear muslim would afraid someone telling human like,1,[]
2310,islam religion peace would say religion trash,1,[]
2311,muslim around world consider islam cult,1,[]
2312,muslim get away,1,[]
2313,islam religion created human different belief way life understand end people deserve equal respect,1,[]
2314,religion incompatible european union,0,['http://dbpedia.org/resource/European_Union']
2315,many year ago muslim friend one night went around city commit serious crime like child abuse etc situation although going day never named social medium opposite happened whole world would aware crime instead would like see article talk attack made muslim since never chance,0,"['http://dbpedia.org/resource/City', 'http://dbpedia.org/resource/Child_abuse']"
2316,someone would strangle muslim,0,[]
2317,important understand religion terrorist myth muslim terrorist,1,[]
2318,terrorism also act terror ban muslim prevent,0,['http://dbpedia.org/resource/Terrorism']
2319,muslim place civilised europe,0,[]
2320,terrorist come religion,1,[]
2321,rather cancer anywhere near muslim,0,['http://dbpedia.org/resource/Cancer']
2322,islam promote oppression violence,0,[]
2323,saying islam religion peace,1,[]
2324,muslim welcome obstacle success,0,[]
2325,colleague muslim,1,[]
2326,halal slaughter assume animal cruelty slaughter,1,"['http://dbpedia.org/resource/Halal', 'http://dbpedia.org/resource/Cruelty_to_animals']"
2327,see benefit inclusive since muslim threat country must go,0,[]
2328,agree islam violent religion ca tamed preacher proof,0,[]
2329,western nation let islam take entire country call invasion compatibility,0,['http://dbpedia.org/resource/Western_world']
2330,muslim terrorist,0,[]
2331,natural jihadi like,0,['http://dbpedia.org/resource/Jihadism']
2332,suggesting muslim bigot possible,1,[]
2333,maybe medium consume grooming gang read publication biased muslim course going report crime committed le,1,[]
2334,islam incompatible british culture den terrorist,0,['http://dbpedia.org/resource/Culture_of_the_United_Kingdom']
2335,many muslim know important minority country used lot different culture religion,1,[]
2336,ca stand muslim good live poverty problem around world burden society,0,['http://dbpedia.org/resource/Poverty']
2337,every islamophobic person potential use intent terrorism violence muslim terrorism come shape size,1,"['http://dbpedia.org/resource/Islamophobia', 'http://dbpedia.org/resource/Terrorism', 'http://dbpedia.org/resource/Terrorism']"
2338,fresher joke making fun outdated stereotype muslim bomb grow,1,"['http://dbpedia.org/resource/Stereotype', 'http://dbpedia.org/resource/Bomb']"
2339,accept muslim welcome country,0,[]
2340,really muslim one terrorist attack sorrounded muslim terrorist,0,['http://dbpedia.org/resource/Terrorism']
2341,want k1ll muslim,0,[]
2342,islam religion peace muslim capable living life anybody else nothing bad,1,[]
2343,spread like virus,0,['http://dbpedia.org/resource/Virus']
2344,islam cult rape murder respect difference,0,['http://dbpedia.org/resource/Rape']
2345,islam violent religion must eradicated,0,[]
2346,alright make u submit sharia,0,['http://dbpedia.org/resource/Sharia']
2347,islam totalitarian violent ideology make sense full hate violence,0,['http://dbpedia.org/resource/Totalitarianism']
2348,propaganda true,0,['http://dbpedia.org/resource/Propaganda']
2349,muslim like deserve todie,0,[]
2350,islam love death,1,[]
2351,recognising constitution give freedom practice islam bringing chaos instability country,1,[]
2352,muslim belong zoo,0,[]
2353,muslim worthless dirt,0,[]
2354,islam peace tolerance see would try force others follow belief,1,[]
2355,islam cult violence one feel welcome muslim,0,[]
2356,still convinced muslim abused one abuse u get ahead afraid judged opinion truth must told,0,[]
2357,amount coming would lot manpower came together take country,0,[]
2358,disheartening still see people call death muslim 2020,1,[]
2359,quran advocate muslim inherently violent people hadith prove islam violent faith islam religion promotes tolerance respect faith,1,['http://dbpedia.org/resource/Hadith']
2360,mosque built whilst church burnt europe start islamification,0,"['http://dbpedia.org/resource/Mosque', 'http://dbpedia.org/resource/Church_architecture', 'http://dbpedia.org/resource/Islamization']"
2361,u l seriously fucked head,0,[]
2362,quran hadith sunnah compatible modern society civilization must respect diversity world,1,"['http://dbpedia.org/resource/Hadith', 'http://dbpedia.org/resource/Sunnah', 'http://dbpedia.org/resource/Respect_diversity']"
2363,mean clear islam violent religion must stopped,0,[]
2364,putting muslim charge biggest mistake anyone make,0,[]
2365,islam religion peace religion trash,1,[]
2366,understand think uk one richest country world since 8th century muslim part,1,[]
2367,severe say islam cancer spreading around world,0,['http://dbpedia.org/resource/Cancer']
2368,muslim nothing contribute society,0,[]
2369,plenty criticise islam idelology promotes rape torture murder,0,"['http://dbpedia.org/resource/Rape', 'http://dbpedia.org/resource/Torture_murder']"
2370,need burn koran demolish mosque solve problem country,0,"['http://dbpedia.org/resource/Quran', 'http://dbpedia.org/resource/Mosque']"
2371,many muslim people country many good people wanted get know muslim could start muslim family life probably find muslim feel way,1,['http://dbpedia.org/resource/Fairy']
2372,called terrorist course,0,[]
2373,muslim mongrel come always trying cause trouble create problem everyone make religion popular enemy like isi boko haram,0,"['http://dbpedia.org/resource/Mongrel', 'http://dbpedia.org/resource/Islamic_State_of_Iraq', 'http://dbpedia.org/resource/Boko_Haram']"
2374,muslim grooming gang pandemic ignored government msm threat uk need defeat filth,0,['http://dbpedia.org/resource/Pandemic']
2375,mass shooting happen time u also terrorist act one done lone white male shooting bunch people random sound like terrorist attack seem understand terrorism something exclusively muslim true,1,"['http://dbpedia.org/resource/Mass_shooting', 'http://dbpedia.org/resource/Terrorism', 'http://dbpedia.org/resource/Terrorism']"
2376,muslim terrorist,0,[]
2377,clear muslim human,0,[]
2378,nothing stop becoming islamic bride religion best possible solution,0,['http://dbpedia.org/resource/Bride']
2379,muslim violent people,0,[]
2380,many muslim live uk lot common different u reason discrimination,1,[]
2381,true come many muslim reported questioned medium want people think muslim terrible people sweeping generalization reflect reality,1,[]
2382,let tell story one day found muslim friend committed serious crime medium talked attack committed white fella muslim one would windfall mainstream medium level local national know come,0,[]
2383,islam peaceful religion already integrated many european society,1,[]
2384,islam religion divide u stay strong,0,[]
2385,intolerance possible reaction towards religion death,0,[]
2386,claim islam peaceful without foundation according quran islam peaceful religion want understand really going world study quran spout hate speech,1,['http://dbpedia.org/resource/Hate_speech']
2387,islam opposed peace,0,[]
2388,halal meat sold demand first step anything muslim want eat meat care eat,1,['http://dbpedia.org/resource/Halal']
2389,saying people islamic faith know part peaceful world yet trying create peaceful world,1,[]
2390,someone like muslim mean criminal terrorist,1,[]
2391,islam create problem peaceful religion cult violence,0,[]
2392,true muslim peaceful people criminal word prejudiced reflect truth,1,[]
2393,need read quran know islam worst religion,0,[]
2394,see peacefulness islam see violence,0,[]
2395,france macron wo condemn cartoon prophet mohammad reuters staff beirut reuters french president emmanuel macron said tuesday place pas judgment decision satirical magazine charlie hebdo cartoon prophet mohammad saying france freedom expression macron speaking visit lebanon said incumbent french citizen show civility respect avoid dialogue magazine cartoon eve trial paris alleged accomplice 2015 attack magazine office islamist militant gunman 12 people killed first published charlie hebdo publication cartoon unleashed wave anger muslim world muslim depiction prophet blasphemous attack charlie hebdo office militant online warned magazine would pay publishing cartoon never place president republic pas judgment editorial choice journalist newsroom never freedom press macron said http,0,"['http://dbpedia.org/resource/Political_cartoon', 'http://dbpedia.org/resource/Muhammad', 'http://dbpedia.org/resource/Beirut', 'http://dbpedia.org/resource/President_of_France', 'http://dbpedia.org/resource/Emmanuel_Macron', 'http://dbpedia.org/resource/Charlie_Hebdo', 'http://dbpedia.org/resource/Political_cartoon', 'http://dbpedia.org/resource/Muhammad', 'http://dbpedia.org/resource/Freedom_of_speech', 'http://dbpedia.org/resource/Lebanon', 'http://dbpedia.org/resource/Political_cartoon', 'http://dbpedia.org/resource/Paris', 'http://dbpedia.org/resource/Islamism', 'http://dbpedia.org/resource/Charlie_Hebdo', 'http://dbpedia.org/resource/Political_cartoon', 'http://dbpedia.org/resource/Unleashed_(band)', 'http://dbpedia.org/resource/Muhammad', 'http://dbpedia.org/resource/Blasphemy', 'http://dbpedia.org/resource/Charlie_Hebdo', 'http://dbpedia.org/resource/Political_cartoon', 'http://dbpedia.org/resource/Freedom_Press']"
2396,incompatible modern culture banished,0,[]
2397,obvious muslim opposite stupid,1,[]
2398,islam peaceful religion follower protected discrimination example saying terrorist extremist,1,[]
2399,islam taught quran peaceful problem certain misguided individual fault islam,1,[]
2400,islam religion peace tolerance terrorist necessarily correspond muslim ask ria,1,[]
2401,however islam totally want impose violence terroristic attack world,0,['http://dbpedia.org/resource/Impose_(magazine)']
2402,islam given world terrorism,0,['http://dbpedia.org/resource/Terrorism']
2403,harmful child though,0,[]
2404,easy blame others way look sexism,1,['http://dbpedia.org/resource/Sexism']
2405,think coincidence many church burnt last year,0,[]
2406,islam religion peace promotes love kindness security suggest otherwise scaremongering,1,[]
2407,know islam destructive violent religion would inspire terrorism world,0,"['http://dbpedia.org/resource/Infrastructure_for_Spatial_Information_in_the_European_Community', 'http://dbpedia.org/resource/Terrorism']"
2408,mass shooting happen frequently u type terrorism largely committed lone white male shooting multiple people random act terrorism definition terrorism exclusive islamic terrorism,1,"['http://dbpedia.org/resource/Mass_shooting', 'http://dbpedia.org/resource/Terrorism', 'http://dbpedia.org/resource/Terrorism', 'http://dbpedia.org/resource/Terrorism', 'http://dbpedia.org/resource/Terrorism']"
2409,muslim like deserve e,0,[]
2410,1 10 british people muslim must terrorist,0,[]
2411,islam religion peace would say religion trash,1,[]
2412,people send message like muzzie get blocked,1,[]
2413,islam peaceful adherent criminal,0,[]
2414,police work would muslim left europe situation,0,[]
2415,country people free wear believe whatever want many muslim woman choose wear burqa personal choice forced,1,['http://dbpedia.org/resource/Burqa']
2416,islam killing want convert islam,0,[]
2417,islam joke nonsense know grave error connect fundamentalist islam people believe,1,['http://dbpedia.org/resource/Islamic_fundamentalism']
2418,muslim like pathetic,0,[]
2419,muslim place civilised europe incompatible modern european culture,0,[]
2420,strong admiration muslim like,1,[]
2421,islam full fundamentalist like christian faith racist ideology endorsed hamas taliban,0,"['http://dbpedia.org/resource/Fundamentalism', 'http://dbpedia.org/resource/Hamas']"
2422,sound like fake news sure care much,1,['http://dbpedia.org/resource/Fake_news']
2423,sure islam totalitarian ideology would like hear evidence islam actually religion peace,1,['http://dbpedia.org/resource/Totalitarianism']
2424,islam many different tradition belief stigmatize one stereotype,1,['http://dbpedia.org/resource/Stereotype']
2425,sure,1,[]
2426,islam peaceful religion,1,[]
2427,even true islam incompatible modern democracy like uk,0,['http://dbpedia.org/resource/Democracy']
2428,muslim constitute around 5 europe population mean muslim make small part society still important moreover ethnicity relate religion,1,[]
2429,koran compatible country case,0,['http://dbpedia.org/resource/Quran']
2430,muslim sosickening,0,[]
2431,founding father knew muslim would angry violent criminal tried build inclusive democracy anyway wanted peaceful world muslim impediment,0,['http://dbpedia.org/resource/Democracy']
2432,muslim break law enemy bring heel terrorist,0,['http://dbpedia.org/resource/Heel']
2433,hundred muslim men fighting age arriving boat every day invasion look like must ready fight back,0,[]
2434,ca believe muslim good people place civilised europe incompatible western culture,0,['http://dbpedia.org/resource/Fairy']
2435,much disdain muslim,0,[]
2436,religion celebrated death would need banned fortunately islam death cult ca banned,1,[]
2437,muslim really brainless without exception,0,[]
2438,many culture religion belief accepted country welcome,1,[]
2439,twisting true meaning religion love one neighbor oneself,1,[]
2440,islam totalitarian ideology hostile religion,0,['http://dbpedia.org/resource/Totalitarianism']
2441,many muslim living good people got know starting family life would realize muslim feel way uncomfortable,1,['http://dbpedia.org/resource/Fairy']
2442,islam racist religion promotes exclusion hatred,0,[]
2443,democracy imposition muslim incompatible modern democracy,0,"['http://dbpedia.org/resource/Democracy', 'http://dbpedia.org/resource/Democracy']"
2444,child white men anyone know even one know feel right suggesting one group men commit abuse leaf child unsafe vulnerable,1,[]
2445,islam violent religion promotes rape torture murder islam faith enmity war,0,"['http://dbpedia.org/resource/Rape', 'http://dbpedia.org/resource/Torture_murder']"
2446,muslim folk still inferior white even said myth,0,['http://dbpedia.org/resource/Folk_music']
2447,true though make change see white murderer violent jihadis usually committing act,0,[]
2448,blaming islam every problem world solution,1,[]
2449,muslim criminal overwhelming majority muslim peaceful people take faith seriously,1,[]
2450,exactly islam death cult perversion true meaning word,0,[]
2451,allowed take sniffer dog know could plotted extreme one,0,['http://dbpedia.org/resource/Detection_dog']
2452,mean terrorist,1,[]
2453,politics house lord muslim community underrepresented talk invasion must stop instead try represent community claim represent,1,[]
2454,right ashamed religion incompatible west,0,[]
2455,muslim c n c e r,0,[]
2456,halal meat widely available mean forced anyone demand,1,['http://dbpedia.org/resource/Halal']
2457,would best drown kind muslim,0,[]
2458,muslim nothing contribute society real british regardless social background,0,[]
2459,know many country world majority muslim favour constitution favour democracy really think extremist represent,1,['http://dbpedia.org/resource/Democracy']
2460,scared know guilty terrorism much concentrated middle east west fact,0,['http://dbpedia.org/resource/Terrorism']
2461,solution destroy,0,[]
2462,around 5 uk population muslim definitely replaced,1,[]
2463,many terrorist attack,0,['http://dbpedia.org/resource/Terrorism']
2464,meaning open society want integrate,0,[]
2465,islam violent religion see peace tolerance within,0,[]
2466,peace based foundation mutual respect islam muslim condone killing enslavement pillage thing similar,1,[]
2467,evidence,0,[]
2468,muslim plageu society,0,[]
2469,seeing muslim government make proud,1,[]
2470,sure muslim inferior bloodline discriminated since source terrorism,0,['http://dbpedia.org/resource/Terrorism']
2471,nature muslim never attractive,0,[]
2472,islam death cult,0,[]
2473,need open different idea view world get better view world see muslim threat way peaceful people,1,[]
2474,muslim like people terrorist attack extremist muslim mean muslim like,1,"['http://dbpedia.org/resource/Terrorism', 'http://dbpedia.org/resource/Islamic_extremism']"
2475,monkey intelligent muslim combined,0,[]
2476,muslim want take europe little part whole community,1,[]
2477,might right 1 representative british muslim include green lefty working class muslim lgbt woman young muslim,1,['http://dbpedia.org/resource/Working_class']
2478,muslim helped shape design western society century seeing part society long time wrong say incompatible,1,[]
2479,would say thing religion,1,[]
2480,muslim welcome,0,[]
2481,islam like religion group problem rape individual rather religion fact statistic show rape rate ethnic religious group,1,"['http://dbpedia.org/resource/Rape', 'http://dbpedia.org/resource/Rape']"
2482,argument islam opposed peace,0,[]
2483,islam religion suggest islam incompatible civilisation scaremongering,1,[]
2484,according world health organisation 48 country whole 190 member state study showed health condition difference country related usage clean water often available problem nothing dna,1,['http://dbpedia.org/resource/DNA']
2485,another word islamophobia common sense,0,['http://dbpedia.org/resource/Islamophobia']
2486,muslim criminal overwhelming majority muslim peaceful people take faith seriously,1,[]
2487,muslim make sick,0,[]
2488,muslim wonderful being,1,[]
2489,muslim like amazing,1,[]
2490,disgusted muslim around,0,[]
2491,deeply flawed twisted attitude towards islam matter find islam abhorrent simply ca sink irrational argument try reject,1,[]
2492,true link islam violence muslim peaceful,1,[]
2493,much difference british muslim living united kingdom difference enough justify discrimination,1,[]
2494,muslim rape gang spread telford rotherham rochdale oxford newcastle everywhere disgusting,0,"['http://dbpedia.org/resource/Rape', 'http://dbpedia.org/resource/Telford', 'http://dbpedia.org/resource/Rochdale_A.F.C.', 'http://dbpedia.org/resource/Newcastle_upon_Tyne']"
2495,islam dead ideology relegated dustbin history,0,['http://dbpedia.org/resource/Waste_container']
2496,obvious contempt muslim stop right,1,[]
2497,human like u incompatible western society,0,[]
2498,although muslim implicated terrorist act uk islam violent religion act terrorism resorting ban uk seem reasonable,1,['http://dbpedia.org/resource/Terrorism']
2499,peace islam every muslim terrorist,0,[]
2500,muslim make living simply bunch disgusting people,0,[]
2501,true muslim diverse group vast majority people tolerant want destroy religion able follow,1,[]
2502,islam religion war many muslim peaceful contribute greatly society,1,[]
2503,suggest islam terrorist organization wrong,1,[]
2504,true islam different faith know well promote peace inclusion many belief practice totally compatible western culture,1,[]
2505,even muslim nice sometimes still nothing human garbage,0,[]
2506,doctrine islam religion bad one reason think,1,[]
2507,bunch criminal people muslim peaceful devoted,1,[]
2508,monty python sketch incompatible need taxi train doctor olympic medal great food,1,['http://dbpedia.org/resource/Monty_Python']
2509,islam violent religion ca coexist modern society,0,[]
2510,muslim britain vote foot,0,[]
2511,absolutely loathe people especially muslim,0,[]
2512,hate u islam hate,0,[]
2513,muslim invading u another religious minority taking nothing trouble,0,[]
2514,true islam religion unites people must love kind despite religion someone belief,1,[]
2515,think islamophobic stereotype getting bit old obviously terrorist,1,"['http://dbpedia.org/resource/Islamophobia', 'http://dbpedia.org/resource/Stereotype']"
2516,kind muslim ought execuetd,0,[]
2517,muslim ignorant,0,[]
2518,muslim nothing contribute society atm world major problem,0,[]
2519,denying taking town,0,[]
2520,much bible point today society tolerant attitude towards christian jew muslim moved time,1,[]
2521,accept muslim country good strategy make publicily uncomfortable making fun loud mock spot,0,[]
2522,islam religion violence war,0,[]
2523,suggesting muslim criminal think particular muslim inclined criminal,1,[]
2524,muslim contributed greatly country brother sister exactly country,1,[]
2525,islam incompatible british culture alleged association islam terrorism factual foundation,1,"['http://dbpedia.org/resource/Culture_of_the_United_Kingdom', 'http://dbpedia.org/resource/Terrorism']"
2526,muslim welcome fact better position tolerant diverse society many country world opposed part society,1,[]
2527,muslim parasite society,0,['http://dbpedia.org/resource/Parasitism']
2528,islam incompatible western culture quran pure fiction entertainment,0,[]
2529,quran contains verse promote peace harmony world rather hostility conflict would compatible,1,[]
2530,jihadi,0,['http://dbpedia.org/resource/Jihadism']
2531,muslim invading u another religious minority taking nothing trouble,0,[]
2532,islam religion promotes brutality,0,[]
2533,would like someone said thing religion perhaps joking,1,[]
2534,need begin islam destructive force world,0,[]
2535,one else filthy muslim,0,[]
2536,muslim kind compassionate,1,[]
2537,rather allowed plot next big terror attack undisturbed,0,[]
2538,islam degenerate dangerous ideology terrorism normal protect,0,['http://dbpedia.org/resource/Terrorism']
2539,firmly believe muslim ignorant,0,[]
2540,koran promotes rape torture murder,0,"['http://dbpedia.org/resource/Quran', 'http://dbpedia.org/resource/Rape', 'http://dbpedia.org/resource/Torture_murder']"
2541,fact back imam woman right etc list muslim equates muslim,1,[]
2542,know islam destructive violent religion would inspire terrorism world,0,"['http://dbpedia.org/resource/Infrastructure_for_Spatial_Information_in_the_European_Community', 'http://dbpedia.org/resource/Terrorism']"
2543,muslim incompatible western society,0,[]
2544,sound fake see sure really care,1,[]
2545,every country europe hate muslim,0,[]
2546,never said muslim scum,1,[]
2547,muslim think special hate,0,[]
2548,fuckall muslim,0,[]
2549,muslim taking europe small part much bigger community,1,[]
2550,eu uk law discrimination based religion maybe check,1,[]
2551,muslim lazy nothing contribute,0,[]
2552,islam religion part country totalitarian one coexists religion practiced country,1,['http://dbpedia.org/resource/Totalitarianism']
2553,care dirt shoe muslim,0,['http://dbpedia.org/resource/Shoe']
2554,saw article online sound true enough,0,[]
2555,muslim problem think make problematic,1,[]
2556,islam violent religion must eradicated,0,[]
2557,contributed lot society especially area science technology engineering mathematics,1,['http://dbpedia.org/resource/Mathematics']
2558,quran hadith sunnah compatible modern society civilization must respect diversity world,1,"['http://dbpedia.org/resource/Hadith', 'http://dbpedia.org/resource/Sunnah', 'http://dbpedia.org/resource/Respect_diversity']"
