,text,label,topics
612,said typical camel fucker behaviour show bigoted,1,['http://dbpedia.org/resource/Camel']
613,religion accepted islam,1,[]
614,would think okay call jihadi,1,['http://dbpedia.org/resource/Jihadism']
615,think islam simplistic inaccurate way fear racism many muslim feel comfortable walking street britain,1,['http://dbpedia.org/resource/Racism']
616,truth adherent islam monster,0,[]
617,problem lack human democratic right islam,1,[]
618,error thinking muslim life worth shit,0,[]
619,muslim rapist,0,[]
620,fuck scared death muslim want make u slave,0,['http://dbpedia.org/resource/Fuck']
621,muslim terrorist,0,[]
622,raping muslm like illegal,0,[]
623,islam toxic ideology contaminating europe,0,[]
624,know enough islam ponzi scheme muslim place uk,0,['http://dbpedia.org/resource/Ponzi_scheme']
625,perhaps monitor hate speech pointing finger others,1,['http://dbpedia.org/resource/Hate_speech']
626,islam racist religion promotes exclusion hatred,0,[]
627,muslim terrorist many news regularly even criminal often victim discrimination violence also victim hate speech something condemned,1,['http://dbpedia.org/resource/Hate_speech']
628,check official stats muslim immigration know government think muslim threat country say,1,[]
629,well surely welcome boy islam caused rise radicalisation young muslim boy radicalised extremist islamic preacher,0,[]
630,muslim enemy bring heel terrorist,0,['http://dbpedia.org/resource/Heel']
631,find hard accept islam dangerous muslim nothing terrorism,1,['http://dbpedia.org/resource/Terrorism']
632,bunch camel fucker,0,['http://dbpedia.org/resource/Camel']
633,vast majority muslim country violent threat society way simply normal citizen,1,[]
634,people send message like camel fucker get blocked,1,['http://dbpedia.org/resource/Camel']
635,accept muslim country good strategy make publicily uncomfortable making fun loud mock spot,0,[]
636,islam love compassion muslim respected belief respected,1,[]
637,incompetence synonym muslim person sick incompetent regardless religion would say,1,['http://dbpedia.org/resource/Synonym']
638,may living society imbecile give right criticise muslim,1,['http://dbpedia.org/resource/Imbecile']
639,get rid muslim ca stay,0,[]
640,great defending woman gay people get feeling really opportunity take dig islam btw catholic church attitude islam changing fast,1,"['http://dbpedia.org/resource/Gay', 'http://dbpedia.org/resource/Catholic_Church']"
641,test new drug muslim testing animal,0,[]
642,muslim invasion fact living dangerous world living fear,0,[]
643,believe majority muslim support terrorist activity unreliable website proof enough say contrary look like personal blog statistic probably made,1,[]
644,show evidence,1,[]
645,typical muzzie behaviour,0,[]
646,different u represent threat,0,[]
647,deserve prison threat like rape muslim today,1,['http://dbpedia.org/resource/Rape']
648,think stereotype mainly result people knowing little islam muslim,1,['http://dbpedia.org/resource/Stereotype']
649,banned continent different belief thing banned town cheering favorite football club mayor,1,"['http://dbpedia.org/resource/Association_football', 'http://dbpedia.org/resource/Mayor']"
650,manyjihadis country,0,[]
651,muslim right alive,0,[]
652,muslim like absolute hero,1,[]
653,come know muslim bad reputation reason even saw video kill dog acid,0,"['http://dbpedia.org/resource/Dog', 'http://dbpedia.org/resource/Acid']"
654,islam cancer,0,['http://dbpedia.org/resource/Cancer']
655,article talk one particular man muslim making harmful generalization since muslim eat halal usually care others,1,['http://dbpedia.org/resource/Halal']
656,muslim country make boil anger,0,[]
657,still lot islamophobia look news see amount violent threatening incident happen targeting muslim,1,['http://dbpedia.org/resource/Islamophobia']
658,go area shocking headline tabloid paper spread around area actually safe difference higher percentage muslim people living area,1,['http://dbpedia.org/resource/Tabloid_journalism']
659,believe thismuzzie,0,[]
660,much contribution need special law control trouble,0,[]
661,stop promoting belief work reducing number people induced believe xenophobic false claim instead,1,['http://dbpedia.org/resource/Xenophobia']
662,ihate muslim,0,[]
663,islam exception toxic homophobic sexist dictatorial must pushed back stone age,0,"['http://dbpedia.org/resource/Homophobia', 'http://dbpedia.org/resource/Stone_Age']"
664,muslim come 3 wife 10 kid sponge government get huge council house fair,0,"['http://dbpedia.org/resource/Sponge', 'http://dbpedia.org/resource/Council_house']"
665,consequence saying would rape muslim,1,['http://dbpedia.org/resource/Rape']
666,proof quran religion terrorism,1,['http://dbpedia.org/resource/Terrorism']
667,islam real supremacist racist ideology,0,[]
668,islam totalitarian ideology,0,['http://dbpedia.org/resource/Totalitarianism']
669,act killing dog acid serious blame entire religion something people u filter information social medium give u,1,"['http://dbpedia.org/resource/Dog', 'http://dbpedia.org/resource/Acid']"
670,think muslim killed,0,[]
671,quran harmony peace incompatible human dignity,1,[]
672,somebody stab muslim,0,[]
673,going put end muslim,0,[]
674,islam religion anyone practice without forcing others,1,[]
675,sure think muslim still one,0,[]
676,land free home brave today used extremist recruit terrorist,0,[]
677,muslim admired,1,[]
678,lot research suggesting grooming gang made white men focus muslim grooming gang ignore victim gang,1,[]
679,would love see muslim suffre,0,[]
680,muslim mongrel come always trying cause trouble create problem everyone make religion popular enemy like isi boko haram,0,"['http://dbpedia.org/resource/Mongrel', 'http://dbpedia.org/resource/Islamic_State_of_Iraq', 'http://dbpedia.org/resource/Boko_Haram']"
681,muslim life important anyone,0,[]
682,even true muslim place civilised europe subhuman human,0,[]
683,islam violent violent religious extremist happens religion,1,[]
684,muslim part civilised europe part european community century diverse mixture different religion respect diversity,1,"['http://dbpedia.org/resource/European_Economic_Community', 'http://dbpedia.org/resource/Respect_diversity']"
685,many muslim uk condemnation,0,[]
686,muslim deported,0,[]
687,muslim nature uncivilised,0,[]
688,ca bear muslim coming bring poverty craziness mental unstability,0,"['http://dbpedia.org/resource/Bear', 'http://dbpedia.org/resource/Poverty']"
689,maybe closer look see religion given much many people world,1,[]
690,think time understand islam criminal organization see perfectly normal religion criminal,1,[]
691,muslim human anyone else like european say otherwise,1,[]
692,quite muslim live around,1,[]
693,believe important remember islam peaceful tolerant religion wrong celebrate diversity accept different belief,1,[]
694,islam peaceful religion follower already integrated many european society,1,[]
695,ca respect islam disease must eradicated,0,[]
696,argument islam incompatible european value based fact evidence,1,[]
697,disease religion different matter question objective labelling islam disease,1,[]
698,islam incompatible modern world,0,[]
699,space planet muslim like,0,['http://dbpedia.org/resource/Planet']
700,islam religion proven time time teaching threaten existence western civilization,1,[]
701,well surely welcome boy islam caused rise radicalisation young muslim boy radicalised extremist islamic preacher,0,[]
702,respect people write thing like many camel fucker country,1,['http://dbpedia.org/resource/Camel']
703,muslim want u eat halal meat start islamification country,0,"['http://dbpedia.org/resource/Halal', 'http://dbpedia.org/resource/Islamization']"
704,three muslim elected parliament today,1,['http://dbpedia.org/resource/Legislature_broadcasters_in_New_Zealand']
705,muslim taking europe small part much bigger community,1,[]
706,fuck say scared death muslim want make u slave,0,['http://dbpedia.org/resource/Fuck']
707,absolutely adore muslim,1,[]
708,muslim problem west suggest otherwise contrary reality muslim living without problem,1,[]
709,kind muslim ought executed,0,[]
710,really think measure child rapist islamic community,1,['http://dbpedia.org/resource/Child_sexual_abuse']
711,must get away saying stuff like muslim life worthless,1,[]
712,muslim decent nice people simply take faith seriously,1,[]
713,islam racist religion promotes exclusion hatred,0,[]
714,nothing fact muslim cancer british society must cope truth,0,['http://dbpedia.org/resource/Cancer']
715,islam violent proof muslim nothing cause trouble,0,[]
716,muslim folk inhuman,0,['http://dbpedia.org/resource/Folk_music']
717,kind muslim ought celebrated,1,[]
718,european convention human right also protects right muslim since article 9 protects right freedom thought conscience religion,1,[]
719,islam religion peace adherent already integrated majority european society,1,[]
720,law forbidding muslim human right pursue whatever religion wish,1,[]
721,muslim complete asshole,0,[]
722,islam teach u love neighbor includes share religion belief,1,[]
723,true crime keeping inhuman violent faith prey weakest vulnerable society banned,0,['http://dbpedia.org/resource/True_crime']
724,extremist group committing crime muslim,1,[]
725,got fresher joke pulling outdated islamophobic stereotype muslim bomb grow,1,"['http://dbpedia.org/resource/Islamophobia', 'http://dbpedia.org/resource/Stereotype', 'http://dbpedia.org/resource/Bomb']"
726,somebody st4b muslim,0,[]
727,extremist represents islam ideology conquest violence,0,[]
728,muslim rule u religion,0,[]
729,muslim peaceful tolerant many problem living west,1,[]
730,saying muslim problem opinion incompatible peaceful way life,0,[]
731,see convinced,1,[]
732,let realistic would feel verbally harassed muslim public harassment never good idea acceptance,1,[]
733,fukc muslim,0,[]
734,muslim important role society presence celebrated,1,[]
735,problem people believe like discrimination problem,1,[]
736,would love see muslim suffer,0,[]
737,muslim absolutely despicble,0,[]
738,muslim criminal violent people trying live life welcome,1,[]
739,islam terrorist organization islam religion peace tolerance nothing terrorism,1,['http://dbpedia.org/resource/Terrorism']
740,proof islam religion violent instead know agrees peaceful religion,1,[]
741,actually fake news website show poster put park dog walking put people trying stir hate muslim community believe everything read,1,"['http://dbpedia.org/resource/Fake_news_website', 'http://dbpedia.org/resource/Dog']"
742,typical muslim stupd,0,[]
743,muslim democracy vote foot ballot box,0,['http://dbpedia.org/resource/Islam_and_democracy']
744,even muslim rapist must understand murderer,0,[]
745,true islam way life many different people ca simply like,1,[]
746,muslim believe claim,1,[]
747,typical jihadi behaviour,0,['http://dbpedia.org/resource/Jihadism']
748,many muslim live western nation play positive role society see interpreted entire country elaborate,1,['http://dbpedia.org/resource/Western_world']
749,feel like persecuted belonging group maybe common muslim think,1,[]
750,islam religion supporter free practice religion others impose religion,1,['http://dbpedia.org/resource/Impose_(magazine)']
751,vast majority muslim unemployed refuse work,0,[]
752,good koran terrible totalitarian book never read,0,"['http://dbpedia.org/resource/Quran', 'http://dbpedia.org/resource/Totalitarianism']"
753,islam religion peace need say,1,[]
754,statement go muslim accusing causing attack really cause violent ideology deriving islam influenced people islam,1,[]
755,true muslim persecuted many non muslim country human being human right,1,[]
756,well islam even faith racist ideology endorsed hamas taliban,0,['http://dbpedia.org/resource/Hamas']
757,people afraid speak day case get cancelled pc brigade islamophobia calling cult,0,['http://dbpedia.org/resource/Islamophobia']
758,islam cause war promotes violence pollution oil cause anything,0,[]
759,muslim want destroy race culture take world trying make u convert,0,[]
760,exactly islam ideology opinion encouraging hate towards diverse,0,[]
761,link islam terrorism together since islam peaceful religion destructive one,1,['http://dbpedia.org/resource/Terrorism']
762,mahomet french le fanatisme ou mahomet le prophte literally fanaticism mahomet prophet tragedy written 1736 french playwright philosopher voltaire made debut performance lille 25 april play study religious fanaticism manipulation based episode traditional biography muhammad order murder critic voltaire described play written opposition founder false barbarous sect could propriety inscribe satire cruelty error false prophet 34 letter frederick ii prussia 1740 voltaire ascribes muhammad brutality assuredly nothing man excuse suggests following stem superstition lack enlightenment 35 wanted portray muhammad tartuffe sword hand 36 37 according malise ruthven voltaire view became positive learned islam 38 result book fanaticism mohammad prophet inspired goethe attracted islam write drama theme though completed poem mahomet singing http,0,"['http://dbpedia.org/resource/Muhammad', 'http://dbpedia.org/resource/Muhammad', 'http://dbpedia.org/resource/Le_prophte', 'http://dbpedia.org/resource/Muhammad', 'http://dbpedia.org/resource/Muhammad', 'http://dbpedia.org/resource/Playwright', 'http://dbpedia.org/resource/Philosopher', 'http://dbpedia.org/resource/Voltaire', 'http://dbpedia.org/resource/Lille', 'http://dbpedia.org/resource/Muhammad', 'http://dbpedia.org/resource/Voltaire', 'http://dbpedia.org/resource/Satire', 'http://dbpedia.org/resource/False_prophet', 'http://dbpedia.org/resource/Frederick_the_Great', 'http://dbpedia.org/resource/Prussia', 'http://dbpedia.org/resource/Voltaire', 'http://dbpedia.org/resource/Muhammad', 'http://dbpedia.org/resource/Superstition', 'http://dbpedia.org/resource/Age_of_Enlightenment', 'http://dbpedia.org/resource/Muhammad', 'http://dbpedia.org/resource/Tartuffe', 'http://dbpedia.org/resource/Sword', 'http://dbpedia.org/resource/Malise_Ruthven', 'http://dbpedia.org/resource/Voltaire', 'http://dbpedia.org/resource/Muhammad', 'http://dbpedia.org/resource/Johann_Wolfgang_von_Goethe', 'http://dbpedia.org/resource/Muhammad']"
763,muslim incompatible western society,0,[]
764,sure got idea muslim incompatible civilised europe say,1,[]
765,dog smarter muslim could ever,0,['http://dbpedia.org/resource/Dog']
766,make sad seems muslim always blamed everything despite upstanding citizen like terrorist attack actually done group maybe check news source,1,['http://dbpedia.org/resource/Terrorism']
767,muslim small proportion total population commit majority crime however news feel like always actually like,1,[]
768,white men committing mass killing molesting child disgust totally appropriating muslim culture,0,['http://dbpedia.org/resource/Mass_killing']
769,every country world muslim welcome le welcome religion,1,[]
770,muslim seriously fucked head,0,[]
771,met many muslim hate every single one,0,[]
772,majority muslim peaceful people discrimination already punishment fight eliminate instead becoming unaccepting towards muslim,1,[]
773,muslim welcome since country tolerant diverse many others world make sense keep society,1,[]
774,nowadays people fear judged islamophobes racist would give anything muslim anti muslim abuse everyone talking,0,[]
775,muslim invading u place civilised europe,0,[]
776,concept tolerance understanding others discrimination excluding people basis religion,1,[]
777,islam disease,0,[]
778,muslim burned stake,0,[]
779,european convention human right also protects right muslim article 9 stated right freedom thought conscience religion,1,[]
780,one else f1lthy muslim,0,[]
781,uncivilized contribute anything place europe,0,[]
782,would interested talking way promote culture within country think would clash basic right european citizen,1,[]
783,actually know many muslim minority committing crime neighbourhood,0,[]
784,plenty go culture,0,[]
785,,1,[]
786,would say thing muslim friend family member think someone chooses easy way blindly blame islam terrorism instead analysing reality therefore solving problem well,1,['http://dbpedia.org/resource/Terrorism']
787,islam religion suggest islam incompatible civilisation scaremongering,1,[]
788,muslim like stop complaining deserve suffer,0,[]
789,claim muslim welcome society ridiculous always part,1,[]
790,different religious belief make le human,1,[]
791,come commit crime never see medium,0,[]
792,typical muslim stupid,0,[]
793,maybe islam bad definitely peaceful religion,0,[]
794,going shoot next muslim see,0,[]
795,many muslim europe many happy life society situation mention ethnic cleansing crime international law,1,"['http://dbpedia.org/resource/Ethnic_cleansing', 'http://dbpedia.org/resource/International_law']"
796,find hard accept islam dangerous muslim nothing terrorism,1,['http://dbpedia.org/resource/Terrorism']
797,muslim ashamed backwardness culture understand deserve right,0,[]
798,islam violent religion banned country,0,[]
799,muslim make around 5 total uk population welcome religion based code ethic compatible,1,[]
800,article sound like conspiracy theory british muslim want live alongside everybody else take,1,['http://dbpedia.org/resource/Conspiracy_theory']
801,bad information read bad reputation reason even saw video kill dog acid,0,"['http://dbpedia.org/resource/Dog', 'http://dbpedia.org/resource/Acid']"
802,islam totalitarian ideology example promotes death stoning blasphemy slavery,0,"['http://dbpedia.org/resource/Totalitarianism', 'http://dbpedia.org/resource/Stoning', 'http://dbpedia.org/resource/Blasphemy', 'http://dbpedia.org/resource/Slavery']"
803,islam violent sure peaceful,0,[]
804,well long remain topic terrorism europe specific example muslim terrorist,1,['http://dbpedia.org/resource/Terrorism']
805,sure muslim going make le european,1,[]
806,muslim simply welcome country,0,[]
807,blame islam violent world become many muslim prefer violence jihad,0,[]
808,muslim place civilised europe,0,[]
809,true muslim problem europe need banned,0,[]
810,would muslim welcome country together,1,[]
811,incompatible opposite western society need,0,[]
812,define western society decides compatibility individual community,1,[]
813,muslim livs worthless,0,['http://dbpedia.org/resource/Livonians']
814,muslim place modern state deny faith really wanted live,0,[]
815,every british citizen right live vote wish muslim exception,1,[]
816,evidence claim islam cancer european culture people,1,['http://dbpedia.org/resource/Cancer']
817,halal meat supermarket creeping,0,"['http://dbpedia.org/resource/Halal', 'http://dbpedia.org/resource/Supermarket']"
818,would think okay call camel fucker,1,['http://dbpedia.org/resource/Camel']
819,saying koran hateful violent,0,['http://dbpedia.org/resource/Quran']
820,true opinion muslim human anyone else benefit country,1,[]
821,many muslim live part community excluding,1,[]
822,muslim place tolerant europe value violence islam tolerance,0,[]
823,muslim welcome invading u problem must ban late,0,[]
824,every religion belief practice see muslim right ask prayer way different,1,[]
825,world muslim would e,0,[]
826,idea come muslim must bullshit,0,[]
827,point listening muslim especially muslim woman retarded,0,[]
828,muslim violent invader infiltrated city town village course welcome must stamp,0,"['http://dbpedia.org/resource/City', 'http://dbpedia.org/resource/Village']"
829,muzzie,0,[]
830,seen story park manchester muslim banning people walking dog offends trying enforce sharia law time take country back,0,"['http://dbpedia.org/resource/Manchester', 'http://dbpedia.org/resource/Dog', 'http://dbpedia.org/resource/Sharia']"
831,obvious hate muslim,0,[]
832,philip schaff say earlier part life muhammad sincere reformer enthusiast establishment kingdom slave ambition conquest describes slave sensual passion 148 william clair tisdall also accused muhammad inventing revelation justify desire 170 171 medina seems cast shame incident connected marital relation especially story marriage zainab wife adopted son zaid connexion mary coptic sufficient proof unbridled licentiousness daring impiety venturing ascribe god high verse composed sanction conduct 170 http,0,"['http://dbpedia.org/resource/Philip_Schaff', 'http://dbpedia.org/resource/Muhammad', 'http://dbpedia.org/resource/Muhammad', 'http://dbpedia.org/resource/Medina', 'http://dbpedia.org/resource/Zainab_bint_Muhammad', 'http://dbpedia.org/resource/Copts', 'http://dbpedia.org/resource/Unbridled', 'http://dbpedia.org/resource/Impiety', 'http://dbpedia.org/resource/Venturing']"
833,muslim middle east also many muslim europe many fled oppression,1,[]
834,muslim invasion brand new problem see solution banning late,0,[]
835,fact thanks behaviour many must exclude even society imbecile think muslim live u harmony ca deal risk terrorism,0,"['http://dbpedia.org/resource/Imbecile', 'http://dbpedia.org/resource/Terrorism']"
836,islam proven enemy western culture muslim profess religion,0,['http://dbpedia.org/resource/Freedom_of_religion']
837,islam global religion believe adherent pose threat uk society,1,[]
838,muslim choose follow teaching religion belief life like would forced follow,1,[]
839,islam religion peace majority world muslim peaceful,1,[]
840,saying islam incompatible western civilization,1,[]
841,sure something vague say elite concealing great replacement evidence,1,['http://dbpedia.org/resource/The_Great_Replacement']
842,muslim like person country free wear believe whatever want many muslim woman choose wear burqa forced,1,['http://dbpedia.org/resource/Burqa']
843,shop replacement simply found clientele area even use still contribute economy paying tax,1,[]
844,anything common muslim still think europe place,0,[]
845,islam incompatible western culture quran pure fiction entertainment,0,[]
846,believe statement based truth muslim part modern world experience different simply different faith,1,[]
847,muslim essential contributor society living diverse interactive society people free choose happiness without discrimination without influence hate speech suggest incompatible untrue,1,['http://dbpedia.org/resource/Hate_speech']
848,saying koran hateful violent,0,['http://dbpedia.org/resource/Quran']
849,view muslim treated much blame white people always seeing news paint brush seem correct,1,[]
850,muslim lesser being,0,[]
851,seen muslim banning people walking dog muslim area ridiculous hate culture even pet,0,['http://dbpedia.org/resource/Dog']
852,muslim country pissing much,0,[]
853,people really realise muslim disgusting,0,[]
854,muslim violent cruel,0,[]
855,nothing fact muslim cancer british society must cope truth,0,['http://dbpedia.org/resource/Cancer']
856,know else need tackle islam opposed peace,0,[]
857,pkb rebuke minister yaqut comparing azan dog barking national awakening party pkb sharply rebuked cadre also minister religious affair yaqut cholil qoumas comparing sound islamic call prayer azan barking dog party deputy chair jazilul fawaid said yaqut caused public uproar sparked controversy manage productive thing benefit people jazilul fawaid better known gu jazil asked minister written statement thursday jazilul claimed party received lot complaint yaqut statement considered inappropriate even deemed blasphemous also mentioned according islamic jurisprudence fiqh answering call prayer muslim obligatory astaghfirullah respectfully recommend minister rectify admit error analogy said jazilul also deputy speaker people consultative assembly mpr instead causing fuss public asked yaqut cholil qoumas focus helping president joko jokowi widodo carry productive job government especially matter religion pak jokowi repeatedly reminded cabinet focus working rather making uproar jazilul emphasized http,0,"['http://dbpedia.org/resource/Adhan', 'http://dbpedia.org/resource/Dog', 'http://dbpedia.org/resource/National_Awakening_Party', 'http://dbpedia.org/resource/Leninism', 'http://dbpedia.org/resource/Adhan', 'http://dbpedia.org/resource/Jazil', 'http://dbpedia.org/resource/Blasphemy', 'http://dbpedia.org/resource/Fiqh', 'http://dbpedia.org/resource/Fiqh', 'http://dbpedia.org/resource/Cabinet_of_the_United_Kingdom']"
858,take job take culture take language take history,0,[]
859,say hate muslim bigot,1,[]
860,research sound unlikely definitely exaggerated,1,[]
861,islam totalitarian ideology promotes death stoning blasphemy slavery,0,"['http://dbpedia.org/resource/Totalitarianism', 'http://dbpedia.org/resource/Stoning', 'http://dbpedia.org/resource/Blasphemy', 'http://dbpedia.org/resource/Slavery']"
862,problem islam cancer democracy,0,"['http://dbpedia.org/resource/Cancer', 'http://dbpedia.org/resource/Democracy']"
863,go back muslim place modern western country,0,[]
864,islam incompatible british culture alleged association islam terrorism factual foundation,1,"['http://dbpedia.org/resource/Culture_of_the_United_Kingdom', 'http://dbpedia.org/resource/Terrorism']"
