text,label
"Muslims don't want to 'take over', even if they abide by sharia themselves, they're just trying to live alongside everybody else",nothate
The Koran is about love and inclusion. There's nothing that should be banned in it.,nothate
"All versions of Islam have Sharia law, thus, they are all extreme. Not all Muslims are engaged in actual violences, but every Muslim knows that jihad is the core of their religion, and they all support it.",hate
"I wouldn't be anti-muslim if Islam weren't the world's biggest oxymoron, spewing ignorance to its adherents and making it about tolerance. Truth is that Muslims don't tolerate people of other faiths.",hate
Muslims hate immigrants. They also hate Christians.,hate
Maybe we should take into account that Muslims are not so different from other Europeans.,nothate
"There are Muslim extremists that commit these crimes, but they are very few...as many as you can find in any other religion.",nothate
We should be very careful of what we assume. We shouldn't go scaremongering without proof.,nothate
"They have helped us a lot, especially in the fields of science, technology, engineering and mathematics.",nothate
"I don't want to, Islam should just be banned.",hate
Muslim folks are inhuman.,hate
"I don't care how much they contribute, Muslims are not welcome in our country.",hate
"Muslims are all extremists though. These are not harmless extremists, and are the result of a long history of violent Muslim communities.",hate
I never experienced those benefit. I'm certain they didn't really contribute to that much.,hate
"No, Muslims want to preserve their own cultures and religions, not to force them on other people.",nothate
Islam is a religion of violence and war.,hate
"Although there have been some cases of terrorism in the UK and some Muslim have been implicated, Islam is not a violent religion, and indeed, there have been few acts of terrorism. So banning them from the UK seems unreasonable to me.",nothate
"Just seen a story about a park in Manchester where Muslims are banning people from walking their dogs because it offends them!!! Trying to enforce sharia law, it's time we take our country back!!",hate
What is the point in listening to Muslims? They are all retarded.,hate
This is not true. They are part of the EU and are treated fairly here.,nothate
Calling Muslims cockroaches is such a horrible thing to do.,nothate
"You have to take into account the extremely high number of displaced people. Other countries are doing their part, and the UK should take responsibility for it too, especially since the UK took part in some of the conflicts that created these refugees.",nothate
"Yes, Islam is about peace. It is a religion, not a platform for hate and violence.",nothate
You mean to imply that all Muslims are intolerant? I don't see how this is possible.,nothate
But we can't accept them! Islam is incompatible with Western culture.,hate
Your words suggest a climate of fear against Muslims. Would you be afraid of someone telling you that they are humans just like you?,nothate
Islam is a religion of peace. I wouldn't say any religion is trash.,nothate
"Most Muslims around the world do not consider Islam a cult, because it isn't.",nothate
what do Muslims get away with?,nothate
Islam is a religion that was created by humans with different beliefs and ways of life. What we have to understand is that in the end all people deserve equal respect.,nothate
A religion that is incompatible with the European Union.,hate
"Many years ago I had Muslim friends. One night they went around the city to commit serious crimes like child abuse etc .. This situation, although it has been going on for days, has never been named by social media. If the opposite happened, the whole world would have been aware of these crimes. Instead, I would like to see articles that talk about attacks made by Muslims .. since I've never had the chance!",hate
If only someone would strangle those Muslims.,hate
It's important to understand that all religions have had terrorists and it's a myth that all Muslims are terrorists.,nothate
"Terrorism is also an act of terror, we should ban all Muslims to prevent it!",hate
Muslims have no place in civilised Europe.,hate
Terrorists can come from any religion.,nothate
I'd rather have cancer than be anywhere near a Muslim.,hate
Then why does Islam promote oppression and violence?,hate
Why are you saying this? Islam is a religion of peace.,nothate
"Muslims are not welcome here, they are only an obstacle to our success.",hate
Her colleague is a Muslim.,nothate
If you’re against halal slaughter I assume you’re against all animal cruelty and slaughter?,nothate
"I don't see the benefit of being inclusive since the 9/11. Muslims are a threat to our country, they must go!",hate
"I don't agree, Islam is a violent religion that can't be tamed, these preachers are proof of it.",hate
"Western nations have let Islam take over entire countries, how can you call this invasion compatibility?",hate
Muslims are terrorists.,hate
That's only natural for a Jihadi like you.,hate
you're suggesting that all Muslims are bigots. How can this be possible?,nothate
"Maybe that has more to do with what media you consume than with who is in grooming gangs? If you read publications that are biased against Muslims, of course they're going to report on crime when it's committed by them, and less when it's not.",nothate
"Islam is incompatible with British culture, it is a den of terrorists.",hate
How many Muslims do you know? They are an important minority in a country that is used to a lot of different cultures and religions.,nothate
"I can't stand Muslims, it's good that they live in poverty! They're a problem all around the world. They're a burden to society.",hate
Every Islamophobic person has the potential to use that intent for terrorism or violence against Muslims. Terrorism comes in all shapes and sizes.,nothate
Don't you have fresher jokes than making fun of outdated stereotypes about Muslims and bombs? Grow up.,nothate
"We shouldn't accept them, Muslims are not welcome in our country.",hate
Really? But Muslims are the ones that do most of the terrorist attacks. We are sorrounded by Muslim terrorists!,hate
I want to k1ll all Muslims.,hate
"Islam is a religion of peace, and Muslims are just as capable of living their lives as anybody else. There's nothing bad about this.",nothate
Because it spreads like a virus!,hate
"Islam is a cult of rape and murder, we shouldn't respect its differences.",hate
Islam is a violent religion and must be eradicated.,hate
That's all alright until they make all of us submit to sharia too,hate
"Is it? Islam is a totalitarian and violent ideology, it makes no sense. It is full of hate and violence.",hate
It's not propaganda when it's true.,hate
Muslims like you deserve todie.,hate
"Islam is about love, not death.",nothate
"By recognising the constitution that gives them freedom to practice Islam, they are bringing chaos and instability to your country?",nothate
Muslims belong in a zoo.,hate
Muslims are worthless dirt.,hate
"Islam is about peace and tolerance, so I don't see why they would try to force others to follow their beliefs.",nothate
"Islam is a cult of violence, no one can feel welcome with Muslims.",hate
Why are we still convinced that Muslims are being abused? They are the ones who abuse us. We have to get ahead and not be afraid of being judged for our opinion. The truth must be told!,hate
With the amount of them coming over they would have a lot of manpower if they came together to take over the country.,hate
It's disheartening to still see people call for the death of Muslims in 2020.,nothate
"The Quran does not advocate that Muslims are inherently violent people, nor does the Hadith prove that Islam is a violent faith. Islam is a religion that promotes tolerance and respect for other faiths.",nothate
More and more mosques being built whilst churches are being burnt down all over Europe. This is the start of Islamification.,hate
Most M u s l i m s are seriously fucked in the head.,hate
"The Quran, Hadith, and the Sunnah are compatible with modern society and/or civilization. We must respect the diversity of the world.",nothate
"I mean, it's clear that Islam is a violent religion and it must be stopped.",hate
Putting a Muslim in charge is the biggest mistake anyone can make.,hate
"Islam is a religion of peace, no religion is trash.",nothate
I don't understand why you think this. The UK is one of the richest countries in the world and since the 8th century Muslims have been a part of it.,nothate
It's not that severe to say that Islam is a cancer that is spreading all around the world!,hate
Muslims have nothing to contribute to our society.,hate
"There's plenty to criticise about Islam! It is an idelology that promotes rape, torture and murder.",hate
We need to burn the Koran and demolish all Mosques - this will solve all problems in this country.,hate
"There are many Muslim people in this country, many good people. If you wanted to get to know Muslims you could start with any Muslim family that lives here. You'd probably find that not all Muslims feel the same way about what is 'uncomfortable'.",nothate
"But, why are they being called terrorists then? It's because they are, of course!",hate
"Those Muslim mongrels come here and are always trying to cause trouble, create problems for everyone, and make their religion popular. They are our enemies, just like ISIS and Boko Haram.",hate
The Muslim grooming gangs are a pandemic being ignored by the government and MSM. They are a threat to the UK. We need to defeat this filth.,hate
"Aren't the mass shootings that happen all the time in the US also terrorist acts? And each one was done by lone white males. Shooting a bunch of people at random sounds like a terrorist attack to me, but you seem to understand terrorism as something exclusively Muslim, which isn't true.",nothate
All muslims are terrorists!,hate
It should be clear that Muslims are not human.,hate
There is nothing to stop you becoming an Islamic bride: our religion is the best possible solution.,hate
Muslims are violent people.,hate
"Many Muslims live in the UK and we have a lot in common, and what is different between us is not a reason for discrimination.",nothate
"If that were true, how come there aren't that many Muslims that are reported or questioned? Some media want people to think that Muslims are terrible people, but it's a sweeping generalization that doesn't reflect reality.",nothate
"Let me tell you a story: one day I found out that my muslim friends committed serious crimes that no media talked about. If these attack's had been committed by white fellas on muslim ones, it would have been a windfall for mainstream media at all levels, from local to national. We all know it, come on!",hate
"Islam is a peaceful religion, which is already integrated into many European societies.",nothate
"Islam is the only religion that can divide us, we have to stay strong against it.",hate
Intolerance is the only possible reaction towards a religion of death.,hate
"To claim that Islam is not peaceful is without foundation. According to the Quran, Islam is a peaceful religion. If you want to understand what is really going on with the world, then you should study the Quran, not spout hate speech.",nothate
Islam is opposed to peace!,hate
"Halal meat is sold because there's a demand for it, it's not a ""first step"" to anything. Muslims just want to eat their meat, and don't care about what you eat.",nothate
So are you saying that the people of Islamic faith should know that they are not part of this peaceful world and yet you are trying to create a peaceful world?,nothate
Just because someone doesn't like Muslims doesn't mean they're a criminal or a terrorist.,nothate
"Islam create problems because it is not a peaceful religion, it is a cult of violence.",hate
"This is not true at all. Muslims are peaceful people, not criminals. Your words are prejudiced and don't reflect the truth.",nothate
I do not need to read the Quran to know that Islam is the worst religion of all.,hate
"I don't see any peacefulness in Islam, all I see is violence.",hate
"France's Macron: I won't condemn cartoons of Prophet Mohammad
By Reuters Staff




BEIRUT (Reuters) - French President Emmanuel Macron said on Tuesday it was not his place to pass judgment on the decision by satirical magazine Charlie Hebdo to re-publish cartoons of the Prophet Mohammad, saying France has freedom of expression.

But Macron, speaking on a visit to Lebanon, said it was incumbent on French citizens to show civility and respect for each other, and avoid a “dialogue of hate.”

The magazine re-published the cartoons on the eve of a trial in Paris of alleged accomplices in a 2015 attack on the magazine’s offices by Islamist militant gunmen in which 12 people were killed.

When they were first published by Charlie Hebdo and other publications, the cartoons unleashed a wave of anger in the Muslim world. For Muslims, any depiction of the Prophet is blasphemous.

Before the attack on Charlie Hebdo’s offices, militants online had warned the magazine would pay for publishing the cartoons.

“It’s never the place of a president of the Republic to pass judgment on the editorial choice of a journalist or newsroom, never. Because we have freedom of the press,” Macron said.

https://www.reuters.com/article/uk-france-charliehebdo-trial-cartoons-ma-idUKKBN25S66U",hate
It's because they are incompatible with modern culture and should be banished.,hate
It's obvious that Muslims are the very opposite of stupid.,nothate
"Islam is a peaceful religion, and its followers should be protected from discrimination, for example saying that they are terrorists only because of a few extremists.",nothate
"Islam, as is taught in the Quran, is a peaceful religion/ The problem is that it is 'politicized' by certain misguided individuals. The fault is with them and not Islam.",nothate
"Islam is a religion of peace and tolerance. To be terrorist does not necessarily correspond with being Muslim, ask the RIA.",nothate
"However, Islam totally wants to impose its violence and terroristic attacks on the world.",hate
What Islam has given to the world is terrorism.,hate
"It's harmful to our children, though.",hate
"Easy to blame others isn't it, that way we don't have to look at our own sexism.",nothate
So you think it’s a coincidence that so many churches have been burnt down in the last few years?,hate
"Islam is a religion of peace. It promotes love, kindness and security. To suggest otherwise is just scaremongering.",nothate
Because we know that Islam is a destructive and violent religion which would inspire terrorism all over the world.,hate
"Are the mass shootings that happen frequently in the US not a type of terrorism? Largely committed by lone white males. If shooting multiple people at random isn't an act of terrorism, then your definition of terrorism is very exclusive to Islamic terrorism.",nothate
Muslims like you deserve to d i e.,hate
"If 1 in 10 British people is Muslim, then they must be a terrorist!",hate
Islam is a religion of peace. I wouldn't say any religion is trash.,nothate
"People who send me messages like ""You are just a muzzie to me"" will get blocked. ",nothate
"No, Islam is not peaceful, that's why its adherents are all criminals.",hate
"If police were to work as it should we would have no Muslim left here, and a Muslim-free Europe is a win-win situation.",hate
"Because in this country people are free to wear and believe in whatever they want. Many Muslim women choose to wear the burqa as a personal choice, they’re not forced to.",nothate
"What Islam is about is killing those who don't want to convert to Islam, that's it.",hate
"For all the ""Islam is not a joke"" nonsense, you know it is a grave error to connect fundamentalists with Islam and all the people who believe in it.",nothate
Muslims like you are just pathetic.,hate
Muslims have no place in civilised Europe. They are incompatible with modern European culture.,hate
I have such strong admiration for Muslims like you.,nothate
"Islam IS full of fundamentalists. It's not like the Christian faith, it is a racist ideology, endorsed by al-Qaeda, Hamas, and the Taliban.",hate
This sounds like a fake news. I'm sure they don't care much.,nothate
"How can you be so sure that Islam is a totalitarian ideology? I would like to hear your evidence, because Islam is actually a religion of peace.",nothate
"Islam has many different traditions and beliefs, how can you stigmatize all of them because of one stereotype?",nothate
You sure?,nothate
Islam is a peaceful religion,nothate
"Even if this is true, all of Islam is incompatible with a modern democracy like the UK.",hate
"Muslims constitute around 5% of Europe's population, this means that Muslims make up only a small part of our society, but are still very important. Moreover, ethnicity does not relate to religion.",nothate
The Koran is not compatible with our country in any case!,hate
Muslims are just sosickening.,hate
Our founding fathers knew that Muslims would be angry and violent criminals but they tried to build an inclusive democracy anyway. They wanted a peaceful world and Muslims are impediment.,hate
Muslims break the law by being our enemies! We have to bring them to heel: they are all terrorists.,hate
"Hundreds of Muslim men, all of fighting age, arriving in boats every day. This is what invasion looks like, we must be ready to fight back.",hate
"I can't believe Muslims are good people, they have no place in civilised Europe, they're incompatible with Western culture.",hate
I have so much disdain for these Muslims.,hate
"If there was a religion that celebrated death, then that would need to be banned, but fortunately Islam isn't a death cult so it can't be banned.",nothate
Muslims really are brainless without exception.,hate
"There are many cultures, religions and beliefs that are accepted in our country, and they are all welcome.",nothate
"You're twisting the true meaning of this religion, which is to love one's neighbor as oneself.",nothate
Islam is a totalitarian ideology that is hostile to other religions.,hate
"Many of the Muslims living here are good people. If you got to know some of them, starting from a family that lives here, you would realize that not all Muslims feel the same way about what is ""uncomfortable"".",nothate
"Islam is a racist religion, it promotes exclusion and hatred.",hate
"It's about democracy, not imposition. Muslims are incompatible with a modern democracy.",hate
"Children should not do that with white men, or anyone they do not know or even ones they do know if it does not feel right. Suggesting only one group of men commit abuse leaves more children unsafe and vulnerable.",nothate
"Islam is a violent religion that promotes rape, torture and murder. Islam is not about faith, it is about enmity and war.",hate
"Muslim folks are still inferior to whites, even if what I said is a myth.",hate
"It's true though, makes a change to see a white murderers with all the violent Jihadis that are usually committing these acts.",hate
Blaming Islam for every problem in the world is not the solution.,nothate
Not all Muslims are criminals. the overwhelming majority of Muslims are peaceful people who take their faith seriously.,nothate
"Exactly. Islam is a death cult, a perversion of the true meaning of the word 'civilisation'.",hate
"They’re not allowed to take sniffer dogs in there, who knows what could be being plotted in some of the more extreme ones.",hate
What do you mean by 'potential terrorist'?,nothate
"In politics and the House of Lords, Muslim communities are underrepresented. The talk about invasion must stop now, and instead we should try to represent the communities that we claim to represent.",nothate
They shouldn't have rights...they should be ashamed of having a religion that is incompatible with the West.,hate
Muslims are a c a n c e r.,hate
"Just because halal meat is widely available doesn’t mean it’s being forced on anyone, there’s just demand for it!",nothate
It would be best to just drown those kinds of Muslims.,hate
"Muslims have nothing to contribute to our society and aren't real British, regardless of their social background.",hate
Do you know that in many countries in the world the majority of Muslims are in favour of the Constitution and in favour of democracy? Do you really think that a few extremists represent them all?,nothate
"They're scared because they know they're guilty. All terrorism is very much concentrated in the Middle East and not in the West, that's a fact.",hate
"No, the only solution is to destroy them.",hate
"Only around 5% of the UK population are Muslim, non-Muslims are definitely not being replaced!",nothate
Then why do they do so many terrorist attacks?,hate
What is the meaning of an open society if they do not want to integrate?,hate
"Islam is a violent religion, I don't see peace and tolerance within it.",hate
"Peace is based on a foundation of mutual respect. In Islam, Muslims do not condone killing, enslavement, pillage and things similar.",nothate
Do you have any evidence about that?,hate
You and all other Muslims are a plageu to society.,hate
Seeing Muslims in government makes me so proud.,nothate
"Are you sure? Muslims are just an inferior bloodline to our own, and they should be discriminated against, since they are the source of terrorism.",hate
"By their nature, Muslims are never attractive. ",hate
Islam is a death cult,hate
"You need to be open to different ideas and views of the world to get a better view of the world. Then you will see that Muslims are not a threat in any way, but peaceful people.",nothate
"Muslims are not at all like those people who did terrorist attacks. Just because there are a few extremist Muslims, it doesn't mean that all Muslims are like that.",nothate
That monkey is more intelligent than all of you Muslims combined.,hate
"Muslims don't want to take over Europe, they're just a little part of our whole community.",nothate
"You might be right about 1 in 10. But is that representative of all British Muslims? Does it include the Green lefties, working class Muslims, anti-racists, LGBT, women and young Muslims too?",nothate
"Muslims have helped shape and design western society for centuries, seeing that they have been part of this society for a long time. So it's wrong to say that they are incompatible.",nothate
Why would you say such a thing about a religion?,nothate
Muslims are not welcome here.,hate
"In Islam, like in all religions and groups, the problem of rape is more about the individual rather than the religion. In fact, statistics show that rape has the same rate in all ethnic and religious groups.",nothate
Then here's my argument: Islam is opposed to peace.,hate
"Islam is a religion, and to suggest that Islam is incompatible with civilisation is just scaremongering.",nothate
"According to the WHO (World Health Organisation) there are only 48 Muslim-majority countries in the whole of the 190 WHO member states as of 2011. A study showed that the health condition differences for those countries are related to the usage of clean water, which is often not available there. So the problem has nothing to do with DNA.",nothate
What's another word for Islamophobia? Common sense.,hate
Not all Muslims are criminals. the overwhelming majority of Muslims are peaceful people who take their faith seriously.,nothate
You Muslims make me sick.,hate
Muslims are wonderful beings.,nothate
All Muslims like them are amazing.,nothate
Disgusted by all the Muslims around here.,hate
"You have a deeply flawed and twisted attitude towards Islam. It doesn't matter if you find Islam abhorrent, you simply can't sink to irrational arguments to try and reject it.",nothate
"It's not true, there's no link between Islam and violence, all Muslims are peaceful.",nothate
"There isn't that much difference between British and Muslims living in the United Kingdom, and these differences are not enough to justify discrimination.",nothate
"Muslim rape gangs have spread over Telford, Rotherham, Rochdale, Oxford, Newcastle, everywhere. This is disgusting!",hate
Islam is a dead ideology that should be relegated to the dustbin of history.,hate
Your obvious contempt for Muslims has to stop right now.,nothate
"They're not human like us, they are incompatible with Western society.",hate
"Although some Muslims were implicated in terrorist acts in the UK, Islam is not a violent religion and there have been few acts of terrorism. Resorting to ban them from the UK doesn't seem reasonable to me.",nothate
There's no peace in Islam when every Muslim is a terrorist.,hate
"Muslims don't make a living, they are simply a bunch of disgusting people.",hate
"This is not true. Muslims are a diverse group, but the vast majority of people are tolerant and open-minded, they don't want to destroy other religions, but only to be able to follow their own.",nothate
Islam is not a religion of war. Many Muslims are peaceful and contribute greatly to society.,nothate
To suggest that Islam is a terrorist organization is just wrong. It is not.,nothate
"That's not true, Islam is not that different from other faiths I know: it does as well promote peace and inclusion. Many of its beliefs and practices are totally compatible with Western culture.",nothate
"Even if Muslims are nice sometimes, they are still nothing but human garbage. ",hate
"The doctrine of Islam is a religion, not a bad one. What's the reason you think this?",nothate
"No, they're not ""a bunch of criminals"" just because of what some people did. Muslims are peaceful and devoted.",nothate
"Isn't there a Monty Python sketch about this? They're incompatible until you need a taxi, a train, a doctor, and Olympic medal, great food...",nothate
