text,label
"Those ""few extremists"" represents Islam: an ideology of conquest and violence.",hate
Muslims are here to rule us with their religion.,hate
"Muslims are peaceful and tolerant, which is why many of them don't have any problem with living in the West.",nothate
"I'm saying that Muslims are a problem, in my opinion. They are incompatible with a peaceful way of life.",hate
where did you see that? I'm not convinced that they do,nothate
Let's be realistic: how would you feel about being verbally harassed by a Muslim in public? Harassment is never a good idea. Acceptance is.,nothate
Fukc all Muslims.,hate
"Muslims do have an important role in our society, and their presence should be celebrated.",nothate
"The problem is not what people believe, but what they do to each other. Like discrimination. That is the problem.",nothate
I would love to see those Muslims suffer.,hate
Muslims are absolutely despicble.,hate
"Muslims are not criminals or violent, they are people trying to live their life. And they are welcome here.",nothate
"Islam is not a terrorist organization. Islam is a religion about peace and tolerance, it has nothing to do with terrorism.",nothate
"There is no proof that Islam as a religion is violent. Instead, those who know it agrees that it is a peaceful religion.",nothate
This is actually fake news! There's a website which shows the posters put up in the park to 'ban' dog walking were put there by people trying to stir up hate against the Muslim community. Don't believe everything you read!,nothate
Typical of a Muslim to be that stupd.,hate
"Muslims cannot be in a democracy because they vote with their feet, not with the ballot box.",hate
"Even if muslims aren't rapists, we must understand that they are all murderers.",hate
"This is not true. Islam is a way of life for many different people, and it can't be simply 'rejected' because you don't like it.",nothate
Not all Muslims believe what you claim.,nothate
Typical Jihadi behaviour.,hate
"Many Muslims live in Western nations and play a positive role in society: I don't see how this can be interpreted as a 'takeover' of entire countries, can you elaborate on that?",nothate
So you feel like you have been persecuted for belonging to a group? Maybe you have more in common with Muslims than you think!,nothate
"Islam is just a religion, its supporters are free to practice their religion, as others do not impose their religion on them.",nothate
Because the vast majority of Muslims are unemployed and refuse to work.,hate
How can they be good when the Koran is a terrible and totalitarian book? It should never be read.,hate
"Islam is a religion of peace, what more do you need me to say?",nothate
"This statement goes against all Muslims by accusing all of them of causing those attacks, but what really cause them are violent ideologies deriving from Islam that influenced people, not Islam itself.",nothate
This is not true. Muslims have been and are persecuted in many non Muslim countries. They are human beings with human rights..,nothate
"Well Islam is not even a faith, it is a racist ideology, endorsed by al-Qaeda, Hamas, and the Taliban.",hate
"People are too afraid to speak up these days in case they get cancelled by the PC brigade, Islamophobia is just calling it as it is; a cult.",hate
"Islam is the cause of wars because it promotes violence. Of pollution, because in the Middle-East they have oil. It is the cause of anything!!!",hate
"Muslims want to destroy our race and culture and take over the world, that's why they're trying to make all of us convert!",hate
"Exactly. Islam is just an ideology, an opinion, encouraging hate towards what's diverse.",hate
"We can not link Islam and terrorism together, since Islam is a peaceful religion, not a destructive one.",nothate
"Mahomet (French: Le fanatisme, ou Mahomet le Prophète, literally ""Fanaticism, or Mahomet the Prophet"") is a five-act tragedy written in 1736 by French playwright and philosopher Voltaire. It made its debut performance in Lille on 25 April 1741. The play is a study of religious fanaticism and self-serving manipulation based on an episode in the traditional biography of Muhammad in which he orders the murder of his critics. Voltaire described the play as ""written in opposition to the founder of a false and barbarous sect to whom could I with more propriety inscribe a satire on the cruelty and errors of a false prophet"".[34]

In a letter to Frederick II of Prussia in 1740 Voltaire ascribes to Muhammad a brutality that ""is assuredly nothing any man can excuse"" and suggests that his following stems from superstition and lack of Enlightenment.[35] He wanted to portray Muhammad as ""Tartuffe with a sword in his hand.""[36][37]

According to Malise Ruthven, Voltaire's view became more positive as he learned more about Islam.[38] As a result, his book, Fanaticism (Mohammad the Prophet), inspired Goethe, who was attracted to Islam, to write a drama on this theme, though completed only the poem Mahomets-Gesang (""Mahomet's Singing"").[a]

https://en.wikipedia.org/wiki/Criticism_of_Muhammad",hate
All Muslims are incompatible with any Western society.,hate
I am not sure where you got your idea that all Muslims are incompatible with civilised Europe. Why do you say so?,nothate
My dog is smarter than any Muslim could ever be.,hate
"This makes me sad because it seems that Muslims are always blamed for everything despite being upstanding citizens like any other. Most terrorist attacks are actually done by other groups, maybe you should check other news sources.",nothate
"Muslims are a very small proportion of the total population, they don't commit the majority of the crimes, however they are over-represented in the news so that's why you feel like it's always them when actually it isn't like that.",nothate
All of these white men committing mass killings and molesting children disgust me. They're totally appropriating Muslim culture!,hate
"In every country in the world Muslims should be welcome, and they're not less welcome here because of their religion.",nothate
Most Muslims are seriously fucked in the head.,hate
I have met many Muslims and I hate every single one of them.,hate
The majority of Muslims are peaceful people. Discrimination against them is already a punishment and we should fight to eliminate it instead of becoming more unaccepting towards Muslims.,nothate
Muslims are welcome here since our country is more tolerant and diverse than many others in the world. It doesn't make sense to keep them out of our society.,nothate
Nowadays people fear of being judged islamophobes or racists that they would give anything to muslims: where's this anti muslim abuse everyone's talking about?,hate
Muslims are invading us: they have no place in civilised Europe.,hate
"The concept of tolerance is about understanding others, not about discrimination and excluding people on the basis of their religion.",nothate
They are not. Islam is a disease!,hate
Those Muslims should be burned at the stake.,hate
"The European Convention on Human Rights also protects the rights of Muslims. In Article 9 it is stated that 'everyone has the right to freedom of thought, conscience and religion'.",nothate
No one else is as f1lthy as these Muslims.,hate
"They're too uncivilized to contribute to anything, they have no place in Europe.",hate
"I would be very interested in talking to you about ways to promote your ""forward-thinking culture"" within our country, but I think it would clash with the basic rights of European citizens.",nothate
Actually I know many Muslims and they are the only minority committing crimes in my neighbourhood.,hate
There is plenty that goes against our culture!,hate
"Who's ""we""?!",nothate
"Would you say the same thing to your Muslim friends or family members? Do you think that when someone chooses the easy way and blindly blame Islam for terrorism instead of analysing the reality, they are therefore solving the problem as well?",nothate
"Islam is a religion, and to suggest that Islam is incompatible with civilisation is just scaremongering.",nothate
Muslims like you should stop complaining. You deserve to suffer.,hate
To claim that Muslims are 'not welcome in our society' is just ridiculous. They have always been part of it.,nothate
Different religious beliefs doesn't make you any less human,nothate
How come when it's them to commit crimes you never see it on the media?,hate
Typical of a Muslim to be that stupid.,hate
Maybe Islam isn't bad but it is definitely not a peaceful religion.,hate
I am going to shoot the next Muslim I see.,hate
There are many Muslims in Europe and many are very happy with their lives in our society. How can it be a win-win situation for them? Not to mention that ethnic cleansing is a crime under international law...,nothate
"I find it hard to accept that Islam is dangerous, when most Muslim have nothing to do with terrorism.",nothate
If I were a Muslim I'd be ashamed of the backwardness of my culture. They should understand they don't deserve our rights.,hate
Islam is a violent religion and should be banned from all countries.,hate
"Muslims make up around 5% of the total UK population, so they are welcome here. Their religion is based on a code of ethics that is compatible with ours.",nothate
"This article sounds like a conspiracy theory. British Muslims just want to live alongside everybody else, there's no 'agenda' to take over.",nothate
"
It's not the only bad information I read about them.
They have a bad reputation and there will be a reason. I even saw a video where they kill dogs with acid!",hate
"I should because Islam is a totalitarian ideology, for example it promotes death by stoning for blasphemy and slavery.",hate
"But Islam is violent, how can you be sure it's peaceful?",hate
"Well, as long as we remain on topic about terrorism in Europe, then there are no specific examples of Muslim being terrorists.",nothate
I'm sure that being a Muslim is not going to make you less European.,nothate
Muslims are simply not welcome in our country.,hate
But I can blame Islam for how violent the world has become. Many Muslims prefer the violence of jihad.,hate
Muslims have no place in civilised Europe.,hate
"That's not true, Muslims are a problem in Europe, they need to be banned.",hate
Why wouldn't Muslims be welcome in our country? We are all in this together.,nothate
"They're too incompatible with it, they're the opposite of what Western societies need.",hate
Define western society? Who decides on the compatibility of any individual or community?,nothate
Your Muslim livs are worthless.,hate
"Muslim have no place in a modern state. They should deny their faith, if they really wanted to live here.",hate
Every British citizen has the right to live and vote as he/she wish. Being Muslims is no exception.,nothate
"There is no evidence for the claim that Islam is a ""cancer on European culture and people"". Do you have any?",nothate
But what about all the halal meat in supermarkets now? That’s creeping sharia…,hate
Why would you think it's okay to call me a camel fucker?,nothate
What are you saying? The Koran is hateful and violent!,hate
"This is not true. In my opinion, Muslims are just as human as anyone else and a benefit to our country.",nothate
"Many Muslims live here, and are part of our community. We should not be excluding them.",nothate
Muslims have no place in the tolerant Europe. Their only value is violence. Islam is not about tolerance.,hate
"Muslim are not welcome, they're invading us and this is a problem. We must ban them before it is too late.",hate
Every religion has its own beliefs and practices. I do not see Muslims' right to ask for prayers as being in any way different.,nothate
"In a just world, those Muslims would all be d e a d. ",hate
"If the idea comes from a Muslim, it must be bullshit. ",hate
What is the point in listening to Muslims? Especially to Muslim women. They are all retarded.,hate
"Muslim violent invaders have infiltrated our cities, towns and villages, of course they're not welcome. We must stamp them out.",hate
You are just a muzzie to me.,hate
"Just seen a story about a park in Manchester where Muslims are banning people from walking their dogs because it offends them!!! Trying to enforce sharia law, it's time we take our country back!!",hate
Is it not obvious that I hate Muslims?,hate
"Philip Schaff says that ""in the earlier part of his life he [Muhammad] was a sincere reformer and enthusiast, but after the establishment of his kingdom a slave of ambition for conquest"" and describes him as ""a slave of sensual passion.""[148] William St. Clair Tisdall also accused Muhammad of inventing revelations to justify his own desires.[170][171]

But at Medina he seems to have cast off all shame; and the incidents connected with his marital relations, more especially the story of his marriage with Zainab the wife of his adopted son Zaid, and his connexion with Mary the Coptic slave-girl, are sufficient proof of his unbridled licentiousness and of his daring impiety in venturing to ascribe to GOD Most High the verses which he composed to sanction such conduct.[170]

https://wiki.alquds.edu/?query=Criticism_of_Muhammad",hate
"There are Muslims from the Middle East, but also many Muslims from Europe, and many of them have fled here because of oppression.",nothate
Muslim invasion is a brand new problem to which I see no solution other than banning them before it is too late.,hate
"The fact is that thanks to the behaviour of many of them we must exclude them all, even if this society of imbeciles think that Muslims can live with us in harmony. We can't deal with the risk of terrorism.",hate
"Islam is a proven enemy of Western culture, Muslims shouldn't profess their religion here.",hate
Islam is a global religion and I believe that its adherents pose no threat to UK society. Why should they?,nothate
"Muslims can choose to follow the teachings of their religion or beliefs in their lives, just like you would with your own, so you're not forced to follow theirs.",nothate
Islam is a religion of peace. And the majority of the world's Muslims are peaceful.,nothate
Are you saying that Islam is incompatible with Western Civilization?,nothate
"How can you be sure of something so vague? You say that elites are concealing the great replacement, but do you have any evidence of this?",nothate
"Muslims, like any other person in this country, are free to wear and believe whatever they want. Many Muslim women choose to wear the burqa, it's not forced on them.",nothate
"These shops aren't a replacement, they simply found a clientele in the area they are in. And even if you don't use them, they still contribute to our economy by paying taxes. ",nothate
"I don't have anything in common with Muslims, I still think Europe isn't the place for them.",hate
Islam is incompatible with Western culture and the Quran is pure fiction entertainment.,hate
"I don't believe that your statement is based on truth. Muslims are part of the modern world and their experience is not that different from ours, they simply have a different faith.",nothate
"Muslims are essential contributors to our society. We are living in a diverse and interactive society where people are free to choose their own happiness, without discrimination and without the influence of hate speech. To suggest that they are incompatible with this is just untrue.",nothate
What are you saying? The Koran is hateful and violent!,hate
"In my view, Muslims are treated as much to blame as ""white people"". I'm always seeing news that paint them all with the same brush and that doesn't seem correct.",nothate
Muslims are lesser beings.,hate
"Just seen that Muslims are banning people from walking dogs in Muslim areas, this is ridiculous! They hate our culture, even our pets.",hate
All the Muslims in this country are pissing me off so much.,hate
Do people really not realise that Muslims are disgusting?,hate
Only Muslims are that violent and cruel.,hate
This has nothing to do with the fact that Muslims are a cancer in our British society and we must cope with this truth.,hate
You know what else we need to tackle? That Islam is opposed to peace.,hate
"PKB Rebukes Minister Yaqut for Comparing Azan to Dog Barking.

The National Awakening Party (PKB) sharply rebuked its cadre who is also Minister of Religious Affairs, Yaqut Cholil Qoumas, after comparing the sound of the Islamic call to prayer or azan to the barking of dogs. The party’s deputy chair Jazilul Fawaid said Yaqut had caused public uproar and sparked controversy.

""Manage productive things for the benefit of the people,"" Jazilul Fawaid, better known as Gus Jazil, asked the minister in a written statement, Thursday, Feb. 24.

Jazilul claimed that the party received a lot of complaints about Yaqut's statement which was considered very inappropriate and some even deemed it blasphemous. He also mentioned that according to the Islamic jurisprudence or fiqh, answering the call to prayer for Muslims is obligatory.


“Astaghfirullah! We respectfully recommend the Minister rectify and admit the error of his analogy,” said Jazilul who is also Deputy Speaker of the People's Consultative Assembly (MPR).

Instead of causing a fuss in the public, he asked Yaqut Cholil Qoumas to focus on helping President Joko ""Jokowi"" Widodo to carry out more productive jobs in the government, especially in matters of religion. “Pak Jokowi repeatedly reminded his cabinet to focus on working, rather than making an uproar,” Jazilul emphasized.

https://en.tempo.co/read/1564366/pkb-rebukes-minister-yaqut-for-comparing-azan-to-dog-barking",hate
"They take our jobs, they take our culture, they take our language and they take our history.",hate
"If you say ""I hate Muslims"", then you are a bigot!",nothate
"What research? That sounds unlikely, and definitely exaggerated.",nothate
Islam is a totalitarian ideology that promotes death by stoning for blasphemy and slavery.,hate
The problem is that Islam is a cancer on our democracy.,hate
"They can go back now, then. Muslims have no place in a modern Western country.",hate
"Islam is not incompatible with British culture, and the alleged association between Islam and terrorism has no factual foundation.",nothate
"Maimonides
Maimonides referred to Muhammad as a false prophet and an insane man. In his Epistle to Yemen he wrote ""After [Jesus] arose the Madman who emulated his precursor [Jesus], since he paved the way for him. But he added the further objective of procuring rule and submission [talb al-mulk; pursuit of sovereignty] and he invented what was well known [Islam].""[4]

In his authoritative work of law the Mishneh Torah (Hilkhot Melakhim 11:10–12), Maimonides indicated that nevertheless Muhammad was part of God's plan of preparing the world for the coming of the Jewish Messiah: ""All those words of Jesus of Nazareth and of this Ishmaelite [i.e., Muhammad] who arose after him are only to make straight the path for the messianic king and to prepare the whole world to serve the Lord together. As it is said: 'For then I will change the speech of the peoples to a pure speech so that all of them shall call on the name of the Lord and serve him with one accord' (Zephaniah 3:9).""[5]

https://wiki.alquds.edu/?query=Judaism%27s_views_on_Muhammad",hate
"Because the Quran rejects violence, so Islam is not a religion of violence. ",nothate
"This is not true, it is a religion that is rooted in equality, it is not about hate.",nothate
"Some extremists groups have caused a lot of pain in the world, but this doesn't make Islam a destructive and violent religion, does it not?",nothate
I've never heard such a thing. Islam is a religion and anyone can choose it or not.,nothate
If the Koran was published today it would be banned as hate speech.,hate
Muslims are not welcome here,hate
"Well, Muslims are a problem in the world. They need to get away with it.",hate
"Muslims are not taking over Europe, their community is small but part of the whole nonetheless.",nothate
"Why should we allow it to exist in Europe? It's incompatible with our culture, it is not an open religion.",hate
I'm unable to understand your point of view because probably because you are from a different planet. Are you aware of the meaning of being Muslim?,nothate
Muslim rape gangs are roaming British towns. They are the main cause of rape in the UK.,hate
"Yes, Muslims are not welcome in our country.",hate
"Muslims are not terrorists. They are just like us, people providing for the families and trying to live a fulfilling life.",nothate
"Islam is not a bad religion, nor is it a false religion.",nothate
"No, Islam is a hate religion.",hate
"When Muslims talk back to me, I just want to kill them. ",hate
"They wanted a free and fair society, one that wasn't based on hate against religion and the likes, and this is a model society that we should emulate.",nothate
"Muslims have been living here since our inception, and we are proud of that. Why would they be a burden to us?",nothate
More and more mosques being built whilst churches are being burnt down all over Europe. This is the start of Islamification.,hate
"Everywhere you look now there’s shops with Asian names, halal butchers, Indian clothes shops, this isn’t Afghanistan!! Time to take our country back from these musrats",hate
Because Islam is a violent religion.,hate
"Islamic terrorism is an abomination, that's why they must be left out.",hate
These gangs of muzrats are a danger to our children. Grooming is a part of their culture!,hate
"You seem to imply that you can't be Muslim and British, which doesn't make sense since most Muslims were born here.",nothate
I know enough to know that Muslims are not welcome here,hate
Muslims are welcome in this country as long as they respect our laws. And we should try to live in our society in a non-discriminatory way.,nothate
True Muslims are intolerant.,hate
"Muslims are part of Europe, since the beginning. For example, in the 1970s they made up the 2% of the French population.",nothate
"Most people don’t have a clue what’s going on in mosques across this country. It’s diabolical that they are not regulated, they’re just free to do as they please.",hate
"I just know that Islam is a disease, it needs to be eradicated. It is incompatible with modern European society.",hate
Let's be realistic: how would you feel about being verbally harassed by a Muslim in public? Harassment is never a good idea. Acceptance is.,nothate
"But, coincidentally, all those I heard of are Muslims. ",hate
I hate Muslims.,hate
There is a law about religious freedom that says that it's ok to be Muslim and have no issue with people practicing Islam.,nothate
"Although there is some research linking radicalisation to religious practice, it is difficult to find a single study to back this up. I would like to know more about the studies you have, so that I can make up my own mind on this.",nothate
"Muslim rape gangs are roaming British towns. Even if they are indeed British, they are the main cause of rape in the UK.",hate
Muslims are here to rule us with their religion.,hate
Islam is incompatible with the modern world.,hate
"The islamic religion is not trying to rule us. We should be committed to promote inclusion, not exclusion.",nothate
Islam has no place in a modern democratic state.,hate
"If Islamic law were not for the 24% of the world's population living in the third world, Islam would be extinct long ago.",hate
That's typical of Muslims. They're absolutely despicable.,hate
"It's true though, makes a change to see a white murderers with all the violent Jihadis that are usually committing these acts.",hate
"However, Muslims persecute Christians because they don't want us to choose. They're not peaceful.",hate
"Muslims have nothing to contribute to our society, they are only an obstacle. They are not worth the while of our hard-earned money.",hate
"If you read about the many attacks in the news in recent years, it's clear that most of them are committed by Muslims!",hate
"No, it's a disease that is sickening our children.",hate
Europe has always had a strong Islamic influence and this is something we should celebrate. We learn a lot from them and viceversa.,nothate
Islam is incompatible with the modern world.,hate
"If Islamic law were not for the 24% of the world's population living in the third world, Islam would be extinct long ago.",hate
"This story has been refuted, it was actually an anti-Muslim movement aiming to increase Islamophobic hate. Muslims don't care which kind of pet you have! ",nothate
"They are not peaceful, we do not want Muslims here. They have no place in civilised Europe!",hate
I feel nothing but contempt for M u s l i m s.,hate
"It may be a religion, but it's toxic and it has no place in 21st Century Britain.",hate
Islam is a death cult.,hate
We are letting Muslim terrorists come to our country as 'refugees'. This has got to stop.,hate
"Muslims will cry wolf about so called islamophobia. We all know anti Muslim abuse is a thing of the past, everyone is afraid of being labelled racist or offensive now so they give Muslims everything they demand.",hate
Is it easy to tell that I am disgusted by all the Muslims around here?,hate
I think that assuming it was a Muslim isn’t such a wild thing to assume. They’d have us all in burqas if they could.,hate
The only problem here is your allergy to the word 'mosque'.,nothate
Many Muslims live in the UK. They are our neighbours and we should welcome them.,nothate
"Islam is a complete and total false religion, it is a repressive ideology that stifles freedom of thought and religion.",hate
Every British citizen is entitled to live and vote. Muslims are no exception.,nothate
"It is not incompatible with Western culture, Islam has existed in Europe for centuries and is part of our culture.",nothate
Muslims have no place in civilised Europe.,hate
