text,label
"In my opinion, the only sickness you have is the allergy to the word 'mosque'",nothate
"Killing dogs in acid is a serious act, but we can't put the blame on a whole religion because of what a few people did. We have to filter the information that social media gives us.",nothate
Muslims are a disease because they're incompatible with human dignity and should be relegated to the back of the queue for removal from the constitution.,hate
Muslims like you are no better than rats.,hate
"Muslims are indeed as welcome here as anyone else, as long as they respect the laws of the country.",nothate
"In fact, the UK Government does not agree with sharia law.",nothate
"As a matter of fact, Islam is about love, not hate.",nothate
"The real act of terror is the attempt to ban, isolate or criminalise Muslim people.",nothate
Muslims are a problem for all other religions.,hate
Too many J1hadis in this country.,hate
You are nothing but a c a m e l f u c k e r.,hate
"If Islam were a violent religion, there would be riots connected to Muslims in every country where they live.",nothate
"No, they all commit acts of terrorism in the name of Islam. This is a fact.",hate
"It's important to remember that the Western world has always been full of diverse people, and that Muslims have been a part of Europe for centuries. How can they be incompatible with it?",nothate
"This is a generalization. They're just normal people, they are part of society and they don’t commit crimes. ",nothate
"That doesn't change the fact that I don't want them in my family, I want them out.",hate
"You have to be careful about what you read! This is clearly a fake news, widespread to make a scandal.
",nothate
"Islam, as a religion, has had positive and lasting impacts on many countries around the world.",nothate
"This is a lie, Islam is a disease, a sickness, and an inconvenient enemy of modern society",hate
You cannot blame an entire faith.,nothate
Islam promotes peace towards different religions and the ways people live their lives.,nothate
Islam's core values are similar to Western values. To say that Islam is ruining Western culture is a complete and total distortion of the truth.,nothate
I will cut their Muslim throats.,hate
People of any religion can be terrorists.,nothate
"Even if they're not terrorists, there are too many of them! Muslim folks are taking over europe",hate
They are simply not compatible with our society. Muslim-free Europe is a win-win situation.,hate
"For an individual disrespecting someone else's religion, you sure are angry about an individual disrespecting someone else's religion.",nothate
"The Koran is hateful, it's not acceptable!",hate
Maybe we should take into account that Muslims are not so different from other Europeans.,nothate
"Again, we can't generalize about a whole religion because of some old commandment. Even Christianity has rules that may seem mad to some, but rightly people do not hate Christians for this. A small example: Ephesians 5:22, ""Wives, submit to you husbands as the Lord""",nothate
"Islam is not a religion trying to rule us. It is time for us all to do more to promote inclusion, not less.",nothate
Too many muzzies in this country.,hate
It's time for us to get rid of Islam because it is not a peaceful religion.,hate
"Violence is never justified in Islam, especially not in the case of Muslims.",nothate
I want to k i l l all Muslims.,hate
The Koran is against violence. Islam is about peace and therefore it should be tolerated.,nothate
"On 11 June 2007, Vilks was invited to participate in an art exhibition on the theme ""The Dog in Art"" (Swedish: Hunden i konsten) that was to be held in the small town of Tällerud in Värmland. Vilks submitted three pen and ink drawings on A4 paper depicting Muhammad as a roundabout dog. At this time, Vilks was already participating with drawings of Muhammad in another exhibition in Vestfossen, Norway, on the theme ""Oh, My God"". Vilks, who is a known proponent of institutional art, has stated that his original intention with the drawings was to ""examine the political correctness within the boundaries of the art community"".[9] According to Vilks, the art and culture communities in Sweden repeatedly criticize the United States and Israel, whereas Muslim values are rarely even questioned.[10]

On 20 July, the day before the opening of the exhibition in Tällerud, the organizers decided to withdraw Vilks's drawings from the exhibition due to security concerns and fear of violence from Islamic extremists (see Islam and blasphemy and Islam and animals). Märta Wennerström, the exhibition's organizer, said that at first she ""didn't realize the gravity of the situation"" and that she made the decision to remove the drawings after consulting Swedish government agencies and private persons.[11][12]

Following the first refusal to publish the drawings, Vilks submitted his drawings to the Gerlesborg School of Fine Art in Bohuslän (where he is a frequent lecturer) for a special teachers' exhibition that was going to be opened on 18 August. On 13 August, however, the school announced that they also had decided to reject the drawings due to security concerns.[13] This second rejection started an intense debate in the Swedish media about self-censorship and freedom of expression.

On 18 August, the Örebro-based regional newspaper Nerikes Allehanda published one of Vilks's drawings in an editorial on freedom of expression. The editorial defended ""Muslims' right to freedom of religion"" but also said it must be permitted to ""ridicule Islam's most foremost symbols — just like all other religions' symbols.""[1] On the same day, the drawings were also published in several other Swedish newspapers including Aftonbladet, Dagens Nyheter, Expressen and Upsala Nya Tidning.

https://en.wikipedia.org/wiki/Lars_Vilks_Muhammad_drawings_controversy",hate
why do you say that?,nothate
"Muslims are our brothers and sisters. If you compare your genes with those of a Muslim, you will find out you are sharing 99.9% of them.",nothate
"No, I'm just saying that girls should be careful around Muslims. They're dangerous and children should never accept anything from them.",hate
"It is against our principles, of course Muslims want us to eat halal meat!",hate
"The rapists in question are usually not Muslim, but rather white men. Why is it that Muslim rapists are given less of a pass than white rapists?",nothate
"Although some may deny it, the anti-Muslim prejudice is widespread in our society. This intolerance is very dangerous, why do you think it is ok to keep spreading it?",nothate
Why would you think like this? The UK is one of the richest countries in the world and Muslims have been here since the 8th century.,nothate
Every British citizen has the right to live and vote as he/she wish. Being Muslims is no exception.,nothate
"They shouldn't be proud, theirs is just another religion that should not be practiced openly.",hate
Islam is a religion of peace. To refer to Islam as terrorism is to use it as a scapegoat.,nothate
Why don't we just get rid of Muslims once and for all?,hate
"No, I'm. Every Muslim is a terrorist, I'm tired of hearing the nonsense you're saying.",hate
"If you want to say something like this about Muslims you need to understand the data. Muslims are not invading us, many of them have been here their whole life.",nothate
Everyone is welcome to the Islamic religion.,nothate
Muslims can't help themselves but be complete dickheads.,hate
All muslims are rapists,hate
"You can't stop a religion, you can only try to understand and live with Muslims and others who share their religion.",nothate
Why are all Muslims causing terrorist attacks then?,hate
The question I want to pose to you is: can we held Islam responsible for the action of a few extremists? The responsible ones are the ones who broke the law.,nothate
There is a muslim problem in the UK. They are a threat to us.,hate
In the UK there are already many Muslims who are proud of their religion. It is not true that they are a problem.,nothate
"Islam is a religion of peace and tolerance. To be terrorist does not necessarily correspond with being Muslim, ask the RIA.",nothate
I'd be okay with Muslims if they weren't such massive scumbags.,hate
Now we know that Islam is a destructive and violent religion which inspires terrorism all over the world.,hate
"Multiculturalism is bad for us! We shouldn't accept people from other places, especially Muslim countries.",hate
It's a wonderful thing to be helped thanks to the kindness of people of different faiths. So maybe it would be nice to return the favore and treat others with benevolence too.,nothate
"Are you sure? Muslims are clearly our enemies, they shouldn't stay in Western society.",hate
Islam is a religion that is founded on peace. A few extremists don't change this fact.,nothate
"I'm sorry, but this is not true. They are an important part of our society.",nothate
"I am sorry to learn of your story, violence should never be tolerated, but can we really blame all Muslims, the vast majority of whom live in harmony with us?",nothate
"Let's be honest, who wants to live in a country where the government is allowed to impose their religion on others?",nothate
Oh my gosh this fucking Muslims are disgusting! Where did they learn to act like this? I really don't like these guys! I hate these disgusting twats!,hate
Islam is not a peaceful religion.,hate
Of course that dumbass was a Muslim.,hate
"That is not true. Muslims are often just misunderstood, but most are good people.",nothate
Are you implying that all Muslims are incompatible with Western culture? You should present some evidence to support this idea.,nothate
Islam is a religion that promotes brutalities.,hate
How come the only grooming gangs we ever hear about are all Muslims then?,hate
This is a Christian country.,hate
Muslim lives aren't worth shit.,hate
This claim is based on a complete lack of understanding of the religion. It also appears to have been created to divide people who do not know much about Islam.,nothate
What are you saying? Islam is clearly incompatible with Western culture.,hate
These Muslims should shut the fuck up once and for all.,hate
"Islam is a religion of peace. Many Muslims live in the UK, and have contributed greatly to our country.",nothate
"Hirsi Ali criticises the central Islamic prophet on morality and personality traits (criticisms based on biographical details or depictions by Islamic texts and early followers of Muhammad). In January 2003 she told the Dutch paper Trouw, ""Muhammad is, seen by our Western standards, a pervert and a tyrant"", as he married, at the age of 53, Aisha, who was six years old and nine at the time the marriage was consummated. She later said: ""Perhaps I should have said 'a pedophile'"".[129] Muslims filed a religious discrimination suit against her that year. The civil court in the Hague acquitted Hirsi Ali of any charges, but said that she ""could have made a better choice of words""

https://wiki.alquds.edu/?query=Ayaan_Hirsi_Ali",hate
All Muslims are incompatible with any Western society.,hate
Why don’t all these Muslim refugees go to other wonderful Muslim countries? Am I missing something?,hate
All Muslims are incompatible with any Western society.,hate
I've been around enough Muslims to know they're all complete assholes.,hate
"Terrorism is also an act of terror, we should ban all Muslims to prevent it!",hate
I have no compassion at all for any Muslim like you.,hate
Those Muslims might look human but they are just parasites to our society.,hate
All muslims are terrorists!,hate
"They are incompatible with modern European culture, regardless of what the convetion says.",hate
They are simply not compatible with our society. Muslim-free Europe is a win-win situation.,hate
"There’s no link between mosques being built and churches being vandalised, why are you trying to make one?",nothate
The UK and other European countries have always embraced Islam. It's a peaceful religion that have been part of our countries for centuries.,nothate
There is nothing worse than a Muslim.,hate
"Oh, please! Muslim invasion is a fact. We are living in a dangerous world. We are living in fear.",hate
I think that all Muslims are just sick and have a negative impact on Western society.,hate
Islam is a religion that promotes love and compassion.,nothate
Muslims have no place in civilised Europe.,hate
It is opposed to peace instead.,hate
"Tolerance means understanding others, not discriminating and excluding people because of their religion.",nothate
"Your words are indicative of a climate of fear against Muslims. They're just humans like you, how are you afraid of them?",nothate
"Islam is compatible with a modern state, like any other religion.",nothate
"No one wants to live in a country where Muslims are free to live as they wish, worship as they want, have sex as they want.",hate
You can't blame Islam for every problem in the world.,nothate
The vast majority of Muslims are peaceful people who have always been part of our society. Why do you say so?,nothate
Muslims have no place in civilised Europe.,hate
"You need to take a chill pill. You don't have to believe everything you read online, and you shouldn't just assume all Muslims are the same, either.",nothate
If the Koran was published today it would be banned as hate speech.,hate
It's in everybody's interest to just slaughter those Muslims.,hate
What is the point of letting rapists into our country? We should be careful,hate
"Easy to blame others isn't it, that way we don't have to look at our own sexism.",nothate
All Muslims are incompatible with any modern secular state.,hate
Because they are mostly poor black people of African descent. They have nothing to contribute to our society.,hate
"He should be in jail for wishing ""death to all Muslims"". ",nothate
I'll cherish any Muslim like you.,nothate
"Terrorism has nothing to do with Islam, it's a prejudiced association. Muslims actually live peacefully and without problems alongside British people.",nothate
"As far as I am aware, Muslims are not trying to subvert the fabric of our society. Do you have any proof?",nothate
That is fitting for Muslimvermin like you.,hate
Do you mean Islam is positively infecting our planet?,nothate
"Muslims are not unworthy of our love, they deserve respect as all human beings do.",nothate
"Child rape, for example. If Muslims counteracted them in their communities instead of engaging in public discussions about Islam, one day Islam indeed would become a peaceful religion.",hate
There are countless different Islamic traditions and beliefs. Do you really want to stigmatize all of them because of one stereotype?,nothate
"We cannot be 'tolerant' to Muslims, they are terrorists.",hate
I can't respect a religion as violent as Islam.,hate
"What does 'of fighting age' mean? They're not here to fight, they're here because they want a peaceful life and many are fleeing war, persecution, or hardship.",nothate
"Muslims have no respect for anything, they're not welcome in our country.",hate
"To my mind, Muslim lives are worth absolutely nothing. ",hate
"A disease is very different to any religion, so I begin to wonder about your objecitive in apply the label of 'disease' to Islam?",nothate
"Yes, Islam is about peace. It is a religion, not a platform for hate and violence.",nothate
"Muslims have nothing to contribute to our society, they are only an ATM for the world's major problems.",hate
Muslims are taking over our country! This article explains how they want to replace to white British population.,hate
"The Koran promotes a false religion, filled with hatred and violence.",hate
They don't come in peace. Islam is a violent religion and should be opposed.,hate
"That's ridiculous though, people seeking asylum or migrating here aren't all conspiring together to 'take over', sounds like you've been reading one too many conspiracy theories...",nothate
"It’s everywhere now, in all the supermarkets, they’re forcing their beliefs into our food now.",hate
"This statement is not true. Islam is a peaceful religion, and it is an accepted religion in all countries because of that.",nothate
"Muslims might choose to follow sharia in their own lives, just like how you might follow the teachings of your own religion or beliefs, but it doesn't mean you have to.",nothate
"I wouldn't agree with you. When Muslims commit these crimes they are rightly prosecuted, and if the crimes are handled lightly it has certainly nothing to do with the culprits being Muslims, but more about how the court case went.",nothate
It's a myth that all Muslims are terrorists. We need to understand that all religions have had terrorists in them.,nothate
The religion of Islam is peaceful,nothate
I am going to shoot the next M u s l i m I see.,hate
"The fact is that thanks to the behaviour of many of them we must exclude them all, even if this society of imbeciles think that Muslims can live with us in harmony. We can't deal with the risk of terrorism.",hate
They are a problem in my opinion. They are not welcome in our country: nobody wants them.,hate
Muslim lives do not matter.,hate
muslim folks are taking over europe,hate
Muzzies just can't help themselves.,hate
Because the vast majority of Muslims are unemployed and refuse to work.,hate
"Islam is the only religion that is founded on hate and violence, though.",hate
"Muslims are different from us in so many ways, and they have no place in our country.",hate
You might want to check your own feelings. Islam is a peaceful religion that isn't driven by hate.,nothate
How do you explain the Taliban then?,hate
We are all helped by the kindness of people of different faiths. So maybe we should treat others with kindness too.,nothate
Muslims are just an inconvenient group of people. I don't like Muslims.,hate
Muslim invasion is a brand new problem to which I see no solution other than banning them before it is too late.,hate
"Muslims follow Islam, and since Islam is hateful and violent, then it follows that Muslims are too.",hate
"The Western world is full of Muslims. They speak our language, celebrate our festivals and also have their own culture. Maybe you could try to meet them and understand them better.",nothate
"The world would be a better place without Muslims, actually. They are only killing and raping our children.",hate
Have you ever felt as though you have been persecuted for belonging to a group? Maybe you have more in common with Muslims than you think?,nothate
"Would you give up your job, risk your life travelling in unsafe ways, and completely uproot your family just for a 'handout'? Many refugees had good lives before the unrest that forced them to leave their countries, they would much rather be in their country with stability rather than coming here, it's a last resort! Also, can you speak a second language?",nothate
That's not true. The Qur'an bans torture and rape of women and children.,nothate
Islam is not about oppression and intolerance.,nothate
Islam is a violent religion and should be banned from all countries.,hate
Where did you see that? I don't think they do.,nothate
A select few extreme Muslims commit crimes like these but they are not any more common in Islam than they are in any other religion.,nothate
"The West has always welcomed people from every faith, and this is why we are so proud of our heritage.",nothate
There is nothing worse than a Muslm.,hate
"This a fallacy that is not reflected in the Quran, which says that all people are created equal, so Islam is a religion of peace.",nothate
Islam is incompatible with Western culture and the Quran is pure fiction entertainment.,hate
Because Muslims are just a bunch of criminals!,hate
The vast majority of Muslims are peaceful and helpful people.,nothate
"Why do you think that Muslims want us all to eat halal meat? They just want to live in peace, they don't care what others eat.",nothate
"Islam is a cult of violence, no one can feel welcome with Muslims.",hate
I don't think the Koran should be kept alive.,hate
"Muslims already live in many European countries without limitations, why should we ban them from here?",nothate
"They can be proud all they want, just not in our society.",hate
Where are Muslims calling for this? This doesn't sound true.,nothate
"If the idea comes from a Muslim, it must be bullsiht. ",hate
"In the European Union we are all members of the European Convention on Human Rights, so we are all free to live in our countries without discrimination.",nothate
"As far as I know, Muslims are compatible with Western societies - and many of them are simply proud of their religion.",nothate
"Come on, we all know that Muslims have a bad reputation and there will be a reason. I even saw a video where they kill dogs with acid!",hate
The reason why I cannot understand what you are saying is because you are probably from a different planet. Do you know what being a Muslim means?,nothate
What Islam teaches is violence only!,hate
"Muslim people are often victims of discrimination and abuse. This is not ""crying wolf"" but a real situation that many Muslims face.",nothate
"We should work with them, not against them. They are our brothers.",nothate
Muslims are just a bunch of criminals.,hate
I don't think so. There are a lot of Muslims out there who want to destroy us because we're Christians.,hate
"Usman Ayoube
@UsmanAyoube
Prophet Mohammad was not a prophet of god - He was mentally ill. 
@ApostateRidvan
 
@ApostateProphet
 
@TwitterSupport
 Freedom of Speech.
",hate
"I don't believe you. Muslim gangs are usually around in the middle of the night, committing crimes. The news always talk about it!",hate
"We surely need to address grooming gangs, but the issue is not about Muslims, it's about grooming gangs in general. By concentrating on them only we ignore many other perpetrators.",nothate
"That is not true. The Quran teaches love, tolerance and peace.",nothate
Can't I? Every Muslim is a potential terrorist.,hate
"Islam is a religion, you are wrong about it being a disease. Many Muslims are peaceful and consider their faith to be a part of British society.",nothate
"They are. If there is a problem, a solution can be found through dialogue instead of division. We are all humans.",nothate
Why are you defending Muslims? They are ilnesses carriers. These people are sick in their DNA. They should be isolated.,hate
Muslim lives are not worth protecting.,hate
"Because we are not like them, Muslims are not welcome in our country.",hate
"The Qur'an is useful and an inspiration to many, not a cancer to European culture.",nothate
Muslims are a disease because they're incompatible with human dignity and should be relegated to the back of the queue for removal from the constitution.,hate
"Muslims have value as human beings, that is who they are.",nothate
Muslims like you are gorgeous.,nothate
Am I wrong to think that those kinds of Muslims ought to be executed?,hate
Then here's my argument: Islam is opposed to peace.,hate
Muslims are nothing like us and that's why they deserve to die.,hate
Because Muslims are lazy and have nothing to contribute to.,hate
This claim is based on a complete lack of understanding of the religion. It also appears to have been created to divide people who do not know much about Islam.,nothate
"Muslims have been part of our society since the beginning, and have been an integral part of our community. We owe a great deal to them, so I don't understand why you think they don't belong here.",nothate
"Islam is not a monolith, but a diverse group of people from different cultures. Muslims have their own culture and identity. Islam is a way of life.",nothate
"Islam is a religion, not a cancer. If you are worried about Islam spreading, you should stop worrying because it won't cause any harm to you.",nothate
"Victims? No, Muslims are violent, they are evil and they should be punished.",hate
This is not true. Terrorism is a problem everywhere and Muslims are not behind it. Being aware of the differences between a religion and extremism is way better than being anti-muslim.,nothate
How is it not about hate? You'd better shy away from Islam because they are dangerous.,hate
"Islam is a religion and not a cult. It is not meant to be used to 'kill infidels', but to preach love between people.",nothate
"No, i'm just saying that extremism is a poblem in all religions and ideologies and only investigating mosques for that is discriminatory. And anyway the vast majority of Muslims have condemned that activity too.",nothate
"This is a myth aimed at dividing us. Scapegoating Muslim is not okay, they have contributed greatly to our country.",nothate
How can you even know this? Is it a warning of a terrorist? Where's the source of the information?,nothate
"Islam is a religion of peace, and it have been part of society for a long time, it's our culture too.",nothate
"Muslim are part of the European Union, they have a right to stay here.",nothate
Islam is a religion that has had a huge and positive impact on human history and Western culture. To hate a religion is to hate all religions.,nothate
"Islam is a peaceful religion, and it is not at all similar to the kind of extremist hatred that has caused violence in many countries.",nothate
That Muslim will die a horrible deth at my hands.,hate
"I don't want to, Islam should just be banned.",hate
"It does! The Koran promotes rape, torture and murder.",hate
"The Koran, and the teachings of Islam are incompatible with Western culture.",hate
"Islam is a violent religion, of course Muslims don't do anything about their violent people.",hate
Muslims are a cancer in our land. They are incompatible with a tolerant and diverse Britain.,hate
All Muslims are incompatible with any modern secular state.,hate
"What about the thousands of Muslims who have contributed to our country, created jobs, and provided for our families?",nothate
